domain,direction,source_text,target_text,quality_flags,len_ratio,flag_duplicate,english_score_src,english_score_tgt,fijian_score_src,fijian_score_tgt,num_flags
dictionary,fj->en,was,"unknown among fijians of the highlands of viti levu. saqamoce v. to cook overnight, to be ready for eating the next morning, often done for cassava, via, or ivi that can be hard, almost woody. vakasaqa, vakasaqa v. to cook. na dau ni vakasaqa the cook. na vakasaqa nei losana losana’s cooking. saqa, saqata . v. to bump into, collide with. idiom: saqamua prostitute (insulting term), woman of loose morals. mua bum. saqa, saqata . v. to oppose, go against. saqata na nona vakatutu oppose his/her proposal. verb normally used the transitive form saqata. saqata . n . a space little used (part of a room, house, village, nearby bush). saqata . n. space in between two things. internode (of a plant with nodes, such as bamboo, yaqona. syn. tagau, tagona. saqata . n . road.",too_short_or_empty|length_ratio_high,256.6666666666667,False,1.0,0.21374045801526717,0.0,0.030534351145038167,2
dictionary,fj->en,mira,"adj . faded, withered, usually of flowers. mira, miraca, miraka v. to sprinkle (of pepper or salt, for example, though salt was never spinkled formerly, and pepper was unknown), sow (seeds, again a modern practise), to scatter (powder, fine grain). also vakamira, vakamiraca. “mirchaa” (hindi) n. chilli pepper, originally a central american plant, introduced by europeans and/or indians, now very widely used by fijians. often pronounced as a fijian word mirij a. syn. boro gaga, rokete. a related hindi word is golmirch black pepper which is the “true” pepper, piper nigrum, grown commercially at wainadoi, namosi. chilli pepper has no scent but is much cheaper than black pepper which was the original “hot” ingredient of curry. idiom: tamata mirij a hurtful person, one whose words are biting, deceptive. miri, mirica, mirika v. to fall off or out, of many very small things (flowers from stem, fur from animal, hair from human head, light sprinkle of rain). sa miri tu na uluna. his/her hair has fallen out. sa miri",too_short_or_empty|length_ratio_high,255.0,False,0.0,0.1952662721893491,0.0,0.005917159763313609,2
dictionary,fj->en,i,". an attached prefix that indicates a noun adapted from a verbal root-form : isele knife (from the verb “cut” sele); idabedabe seat, chair, saddle (from the verb “to sit” dabe). some fijians prefer to see that “i” float alone, unattached to the noun.",too_short_or_empty|length_ratio_high,250.0,False,1.0,0.3488372093023256,0.0,0.0,2
dictionary,fj->en,ai,"n. locust, cicada, scientific name raeateana knowlesi (or tibicen knowlesi), that as nymphs live underground cm to . m deep, feeding on root juices, for years, lacking wings and reproductive parts. they emerge from the ground en masse around september, climbing trees, moulting (shed their hard skin) and develop wings. they live only two to three weeks, the female laying hundreds of eggs on plant leaves. shells of dead cicadas remain on the plants. the whole season lasts no more than two",too_short_or_empty|length_ratio_high,245.5,False,0.0,0.24691358024691357,0.0,0.0,2
dictionary,fj->en,as,"an attractant. genetic evidence with mitochondrial dna seems now clearly to indicate the protopolynesians brought jungle fowl to chile in long-range voyages. (science news, vol. , june , p. .) they also brought back the sweet potato kumala and retained the name from the americas. idiom: kana yava ni toa lit. eat chicken feet said to a child who is hyper-active, unable to sit still. idiom: solisoli vakatoa lit. giving like a rooster, that is, giving a gift and then taking it back, as a",too_short_or_empty|length_ratio_high,244.5,False,1.0,0.2857142857142857,0.0,0.011904761904761904,2
dictionary,fj->en,kana,"vinaka. it tastes good. na kanavalavala n. the part of the human head on each side of the temple, the part that moves when one eats. vakania na manumanu v. to feed the animals. idiom: kana bui ni vuaka. lit., eat pig ’s tail, refers to a child who cannot sit still, wriggling around like the tail of a pig. idiom: matai via kana vuaka. lit., carpenter who wants to eat pork, i.e., refers to a person who might pretend to diligence and skills but in fact is only interested in how the work is rewarded. idiom: sa kua la na kana! playful flattering words said before a pretty girl. implies she is so pretty that it puts you off your food. idiom: kana vosa to take verbal abuse, get complaints. idiom: kana e loma eats away inside (disease, hurtful words). e kana e loma vei au na nomu vosa. your words feel hurtful to me. idiom: kana, kana! ka o lakova mai. lit. “eat, eat ! that’s what you came for.” teasing a friend who is passing by during a meal, invited to join in.",too_short_or_empty|length_ratio_high,242.25,False,0.0,0.24598930481283424,0.0,0.06417112299465241,2
dictionary,fj->en,same,"meaning of daffy, when speaking about an odd person. it is believed that some people’s behaviour changes with the tide, be it full or low. one may ask then, when someone acts crazily, if it is low tide or high tide. the effect of the tide on people is remarked upon particularly in vanua levu, nasavusavu district, especially villages vivili and waivunia. those locals have a reputation of being daffy in relation to the tide. this is the source of many jokes and funny stories. syn. (colo east) dale, sauvou. . not commonly, but sonaua can occasionally have vulgar connotations when referring to a person, simply because of the coincidence that the sona part of the word means rectum. vulgarity will be indicated by context and tone of voice. soni, sonita v. to pierce or to prick with a sharp object, usually a knife or a needle in these modern times. in earlier times a piece of broken glass might be used, and before that, a sharp piece of seashell. also",too_short_or_empty|length_ratio_high,239.5,False,0.0,0.3333333333333333,0.0,0.0,2
dictionary,fj->en,ga,"ni vatu n. peregrine falcon. syn. (northern lau) tuitui. black head, breast, flank and thighs striped black on cream. staple diet is flying fox fruit bat, finches, pigeons, some sea birds. eyrie on cliffs, - white eggs with brown blotches. watling says the long pointed wings and long tail are distinctive. gano, ganova v. to gape or stare with desire, to lust after. gara, garata v. to snarl wildly, angrily, snort. ucu gara makes a wild angry face (or, simply) have large",too_short_or_empty|length_ratio_high,236.5,False,0.0,0.16049382716049382,1.0,0.012345679012345678,2
dictionary,fj->en,as,"“fijian ailments” (tauvimate vakaviti) that are not readily distinguished in western medicine by having their own name. see baubau, drimi. some fij ians believe witchcraft is the cause of raberabe, but this is a very common belief for virtually all illness or afflictions. rabo, rabota v. to lash, as in the act of whipping, or firing off a sling. sa raboti koya na vai. the stingray lashed him. veirabo lashing. vakarabota na laca flush out the sail (with the wind).",too_short_or_empty|length_ratio_high,233.5,False,1.0,0.275,0.0,0.025,2
dictionary,fj->en,not,"in war.) bau gave some of these breast-plates to viti levu chiefs who co-operated in accepting christianity and bauan leadership . syn. bulutoko also referring to breast-plates. civedre v. to roll or turn up the eyeballs, showing fatigue, unconsiousness, or impending death, or just as a gesture of boredom, or exasperation. syn. civele. civi, civia or civita v. to peel, pare, or chip off the skin (raw yams, taro, cassava; fruit such as wi). civicivi peelings. chipping or carving more deeply into the substance would be ceuta. see also sivi, sivita for a chipping action that would give shape, as to a club or spear, or even a pencil being sharpened.",too_short_or_empty|length_ratio_high,217.66666666666666,False,0.0,0.22123893805309736,0.0,0.0,2
dictionary,fj->en,o,". n. cloud. idiom: sa sega sara ga ni ra bau raica na kena o. they simply could find no trace of him/her at all. lit., they could see nothing at all of his cloud (a cloud hovers over every island, and is a distant",too_short_or_empty|length_ratio_high,213.0,False,0.0,0.24444444444444444,0.0,0.08888888888888889,2
dictionary,fj->en,is,"used for hanging people. anciently , fijians sometime hung up corpses; they never had a person hang as punishment until cakobau hanged his cousin mara kapaiwai in . wa-lili-caka na liga to swing the arms, as in soldiers marching. idiom: (vulgar) p olo lili (or) vakalili soresore ineffectual man or boy, lit. balls (testicles) drooping down, sometimes called out in teasing lako tu o p olo lili! there goes hanging balls !",too_short_or_empty|length_ratio_high,211.0,False,1.0,0.14084507042253522,0.0,0.014084507042253521,2
dictionary,fj->en,lasu,"n., adj . false, lie, falsehood, liar. lasulasu n. lying. lasulasu adj . fake. p arof ita vakailasu false prophet. lasu, lasutaka v. to lie, to lie (about something) or to lie (to someone). kua ni lasutaki au! don ’t lie to me! na ilavo lasutaki the counterfeit money. lasulasu adj . for a person who is a liar. lata n. herbaceous plant, solenostemon scutellarioides, lamiaceae, commonly refered to as coleus, various colours, red, green, yellow, some variegated, used now as decorative outdoor plants. the juice of deep red coleus is taken internally with the rather naive notion that this will induce menstruation. lata is also used for earache. effectiveness remains unproven. syn. beta. lati, latia v. to form a screen, wall or barrier. ilati kau n. wooden screen. nailatikau is a name that reverberates through fij ian history.",too_short_or_empty|length_ratio_high,208.0,False,0.0,0.20588235294117646,0.0,0.022058823529411766,2
dictionary,fj->en,if,"it were of little value. in the bible, soso means earth, as in the burial service. sa soso na nomu isulu. your clothes are muddy. isoso . n. cluster (fruit, nuts such as wi, tarawau, dawa, tavola), shoal or school (of fish). syn. tausoso. soso . n. (medical) carbuncle, one or more very deep , painful boils that begin with a cluster of pimples. some fij ians believe this occurs most commonly on the back and neck.",too_short_or_empty|length_ratio_high,207.5,False,0.0,0.2702702702702703,0.0,0.013513513513513514,2
dictionary,fj->en,as,"a vine climbing trees with leaves only at the top of the plant, and aerial roots grow down to the ground. syn. (cakaudrove) mere. walai n. entada phaseoloides. heavy forest rope. see walai, separately, below. wa loa n. rhizomorpha sp. black, shiny, formerly used for “kilts” or “skirts” for men and women . syn. sausauwai. this and divided plantain leaves made the commonest forms of dress for early fij ians. the",too_short_or_empty|length_ratio_high,206.5,False,1.0,0.2571428571428571,0.0,0.0,2
dictionary,fj->en,igu,"n. force of effort with powerful motivation. e kaukauwa na nodratou igu. their powerful force is strong. nomu igu! give all your effort ! (yelled at athletes). gudea vakaigu to shake it vigorously, energetically. igu matua diligent, diligence. vinaka na igu matua . thanks for trying hard. vagugu, vagugutaka v. to hum, as of a melody, usually when the words have been forgotten. gu, guta, gutaka, guraka v. to apply effort. gu vakaukauwa to try hard. guta vakaukauwa to try hard for it. guraka! really go for it ! idiom: lai guguraki v. go to the toilet (to defecate). this is socially polite usage, more common in the",too_short_or_empty|length_ratio_high,206.33333333333334,False,0.0,0.2761904761904762,0.0,0.0380952380952381,2
dictionary,fj->en,wai,". n. water. e dua na bilo wai a cup of water. wai droka (or) waidranu freshwater. wai ni gunu drinking water, wai tui saltwater. waiwai oil. syn. (tonga) vai. idiom: wai ni vanua ceremonial term for yaqona. idiom: gunu wai ni bele to be reprimanded. idiom: wai ni diva, sega ni kabita. the stuff of dreams, never achieved. wai . n. medicine. vale ni wai n. medical clinic (usually without hospital facilities) where medicines are dispensed. syn. (tonga) vai. idiom: e sega na kena wai. there is no solution for that (problem), lit. no medicine for that condition. sardonically, may refer to love having no cure.",too_short_or_empty|length_ratio_high,203.66666666666666,False,0.0,0.14285714285714285,0.0,0.11428571428571428,2
dictionary,fj->en,up,"the oven. cele, celeva na lovo carefully part and open up the cover-leaves. qe, qeva na lovo remove contents of lovo. kili, kilica open up the lovo and remove cooked food. sa buta sau the ovencontents are undercooked due to a witchcraft spell. buta droka undercooked. qulali over-cooked, root-crops baked too hard. syn. (rewa, beqa, kadavu) irevo. idiom: cara lovo e macawa bald on the crown of the head.",too_short_or_empty|length_ratio_high,202.0,False,0.0,0.20833333333333334,0.0,0.041666666666666664,2
dictionary,fj->en,na,"kai to gather the mussels. sili dri to gather, dive for dri. sisili bathing . era sa sisili tiko na gone. the children are bathing. veisilimi swimming for fun (qalo swim with a purpose). wai ni sili n. bathing-water. wai ni sili n. creek used mainly for bathing. silivata to swim with (clothing worn, knife, warclub, other person). laki sisili ki na savu to go swimming at the waterfall. lai sili to go",too_short_or_empty|length_ratio_high,201.0,False,0.0,0.2191780821917808,1.0,0.0684931506849315,2
dictionary,fj->en,ia,". (or) ia ka but, used as a conjunction (isema) in a sentence. au via lako ia sa sega ni rawa. i want to go but it is not possible. ia, iataka . v. to take place, occur, to be performed or done. sa ia tiko na bose the meeting is taking place. iataka na meke to perform the exhibition-dance. iauwe! emotional interj ection, when a person is surprised, amazed, fatigued, suddenly sorrowful. syn. oiauwe.",too_short_or_empty|length_ratio_high,200.5,False,0.0,0.22972972972972974,0.0,0.08108108108108109,2
dictionary,fj->en,au,"i (or) me. pronoun, st person singular. as the subj ect of the sentence it can become oi au or o yau. preceded by a vowel it may become yau: raica e dua vei keirau, o seru se o yau. see one of us (two, exc. the one being talked to), either seru or me. following the particles me or ni it becomes abbreviated as meu and niu, sometimes seen as me ’u and ni ’u. syn. (tonga) au. (colo east, namosi) ’u.",too_short_or_empty|length_ratio_high,199.5,False,0.0,0.2289156626506024,0.0,0.08433734939759036,2
dictionary,fj->en,as,"useful in the treatment of cancer and other ailments. the fruit is antiseptic but other medical properties are unproven. polynesian names are variants of noni. kurabui adj . surprised, amazed. veika veiva-kurabuitaki amazing things. kurabuitaka to be amazed at it. kurabui, kurabuitaka v. to be surprised at something. sega ni kurabuitaki na nomu digitaki. not surprising that you have been chosen.",too_short_or_empty|length_ratio_high,199.0,False,1.0,0.3114754098360656,0.0,0.04918032786885246,2
dictionary,fj->en,wa,"yaka n. peuraria lobata, papilionaceae (or fabaceae), edible long roots, flesh dirty white in colour, eaten mostly as famine food that can be eaten raw. stems useful as cordage, formerly used for fishing nets. cattle eat the leaves and the leaves are reasonably tasty to humans. new shoots in sept., oct. hairy stem, three-leafed, flowers white tinged with purple. grows wild. syn. (colo) wa sara.",too_short_or_empty|length_ratio_high,198.5,False,0.0,0.19696969696969696,0.0,0.0,2
dictionary,fj->en,dreu,". adj . ripe, ready for eating (usually fruit, including breadfruit). vakadreutaka to ripen fruit (leaving it in sun, or enclosing in bags). veidreu children's game of touch and chase, often played in the water. boi dreudreu smells ripe. fij ian do not necessarily prefer very ripe fruit, and will often reject it if there is any bruise or any insect damage. dreu . (nait.) n. baa. naitasiri was a major producer of baas for export as organised by the british. after independence this export industry died due to failure of responsible marketing with quality control. dreu ! familiar, informal and friendly form of address between people of nadroga and cakaudrove, often used between men and women, with a smile. macuata people use the more full expression draka dreu! meaning sweet lip s!",too_short_or_empty|length_ratio_high,197.25,False,0.0,0.2558139534883721,0.0,0.0,2
dictionary,fj->en,tobe,". n. traditional “curls” of hair hanging down on one or both sides of the head as a sign of a virgin girl. tobe . n. by extension, pigtail or ponytail as worn by man or woman. tobo, toboka v. to catch, seize, capture (person, animal). na lairo, tobotobo rawarawa ena bogi buto the land-crab lairo, easily caught in the dark of night. as an anglicism, one speaks of catching the bus. idiom: tobo koki try to “pick up” girls, lit. catch parrots. vakatobo-i-cu, vakatoboicu-taka v. to turn up side down, bottom up, so to speak . tobu n. pool, pond, bay. torobu very small pond or tidal lake. tobu ni qalo swimming pool, tobu ni sisili bathing pool, swimming pool. titobu deep. toci, tocia v. to smooth off with sharp blade, as tocia na voivoi to cut off spines from the edges of",too_short_or_empty|length_ratio_high,193.75,False,0.0,0.21379310344827587,0.0,0.027586206896551724,2
dictionary,fj->en,kavu,"v. to be blown about by wind, as sand (nuku) might be, or dust (kuvu). kavukavu adj . dry (skin, as on face, from exposure; throat, as when suffering from a cold). kavu n. edible fish, a rock cod, grouper, sea bass, j ew fish, promicrops lanceolatus. that can grow large, to , pounds and a length of feet according to rob wright. more commonly , large ones might weigh lbs and extend to seven feet in length. kavu now mainly classified as a couple of species of genus epinephelus. see kasala. kavuru v., adj ., n. to crumble, crunchy, crunched, crumbs, broken into pieces, crushed, from vuru, vuruka. by ext., kavuru n. butt, stub of a cigarette. ka ni kavuru ash-tray. see kavoro. idiom: kere kavuru beg for crumb s, beg for food, but more commonly, to cadge a cigarette.",too_short_or_empty|length_ratio_high,193.0,False,0.0,0.2608695652173913,0.0,0.014492753623188406,2
dictionary,fj->en,yaws,"caused by a sub-species of the same spirochete. tona n. gonorrhoea. there is no clear distinction in the minds of many younger fijians. coko, cokota . v. to catch (fish on line, in net, in trap, animal in trap or by spearing, person by some trick). in the highlands spears were used for pig-hunting but not for fishing. sa coko kina o koya. he/she is implicated, caught up in that. coko, cokota . v. to wrap up and tie a parcel, usually food or firewood, with leaves (such as via, vuti, balabala). cokota na idrekedreke to wrap and tie the parcel (to be carried on the back of the person or horse). me coko na laca. furl the sail (of a boat). cokoi, cokoya v. to tie up, as in closing certain types of basket such as the idrekedreke, that is borne on the back.",too_short_or_empty|length_ratio_high,190.0,False,0.0,0.3561643835616438,0.0,0.02054794520547945,2
dictionary,fj->en,a,". n. mummy, mum. syn. nau. a levu auntie, elder sister of mother. a lailai auntie, younger sister of mother. for fij ians such aunts are virtually as close a relative as the mother herself.",too_short_or_empty|length_ratio_high,189.0,False,1.0,0.29411764705882354,0.0,0.0,2
dictionary,fj->en,basi,"(eng.) n . bus. waraka na basi. wait for the bus. vodo e na basi. get on the bus. calata na basi. miss the bus. na ikelekele ni basi the bus-stop. basiteni n. bus stand, often referring to a central bus stand in town. idiom: “tailevu no leqa, no basi, paidar”. this is a proud exclamation, vaunting the qualities of tailevu. a curious tri-lingual saying (english, fijian, hindi), lit. there ’s no problem in tailevu. if there is no bus we can walk. the notion is that tailevu is a relatively flat province. if there is no bus one can walk almost anywhere. idiom: qarauna o na sega ni “vodoka na basi ni lokia! an apocryphal, legendary rumour has it that ro lala exclaimed this to her husband ratu kamisese mara, lit. “be careful or you won ’t climb on the",too_short_or_empty|length_ratio_high,188.75,False,0.0,0.2323943661971831,0.0,0.07746478873239436,2
dictionary,fj->en,bau,"island. e vasu ivei o iko ? to what place are you vasu? i.e., what village does your mother come from? vasu, vasuta v. to ask for (something), as in the kerekere custom, where it is virtually impossible to be refused. a special form of demand is that of the traditional vasu (see above) who could in former times, take anything from the maternal uncle without even asking for it. a chiefly child might make very great demands. remts of this custom persist. vasua or vasua dina n. giant clam, tridacna derosa. e dua na matau vasua ten vasua clams offered at a",too_short_or_empty|length_ratio_high,186.0,False,0.0,0.3106796116504854,0.0,0.038834951456310676,2
dictionary,fj->en,no,"pots existed. highlanders never boiled food; they used bamboo containers to steam it, or they simply grilled it. vakariri, vakaririga v. to cause certain foods to be boiled in water, formerly in a clay pot ivakariri. in lau, cook (in a pot or pan), not necessarily boiling. ririko, ririko-taka v. to be apprehensive or anxious about (something), fear what may happen.",too_short_or_empty|length_ratio_high,183.5,False,0.0,0.27419354838709675,0.0,0.0,2
dictionary,fj->en,was,"anciently imperative to have an ear-plug. sau-lili pendant ear-ring. sau-kabi ear-ring that is set on the ear by a screw or clamp. daliga rogorogo very keen hearing. dalidaliga, dalidaligana v. to listen closely, attentively. vakatudaliga to pay attention. syn. (tonga) telinga. close cognates of this word appear throughout the pacific, even among aborigines of taiwan idiom: tara na daliga-na of children, to dare to fight by touching or pulling the opponent’s ear. a sharp , painful pull on the ear is a common punishment for a naughty child.",too_short_or_empty|length_ratio_high,181.66666666666666,False,1.0,0.2765957446808511,0.0,0.02127659574468085,2
dictionary,fj->en,gi,"v., n. buzz, as of mosquitos. gi, givaka v. to squeak (bat), squeal (pig), yelp (dog, person), buzz (mosquito). na cava e givaka na vuaka ? what's the pig squealing about? children make the sound gi in teasing and reproaching each other. it goes with a facial expression and sometimes pinching. in former times, warriors were said to make this sound in attacking.",too_short_or_empty|length_ratio_high,181.5,False,0.0,0.27419354838709675,0.0,0.04838709677419355,2
dictionary,fj->en,tone,"(eng.) n. metric tonne. toni, tonia v. to dunk, steep. fij ians often dunk or sop their starch-foods in a liquid, especially biscuits in tea. biscuits may thus be eaten without butter or j am, and are softened and easier on the teeth. toni somo soak in mud in process of dyeing black some pandanus leaves for mat-weaving or sinnet cord for decorative binding. toni moce to soak overnight. see bolomo. tono, tonoka, tonolaka v. to poke, as with the pointed fingers, or a sharp instrument. itono poker, stick or any long, pointed thing used to poke. idiom: vosa tonotono mata talk accusingly, poke one’s nose in the affairs of others, or one's finger in another's face, direct talking, lecturing other people on their behaviour.",too_short_or_empty|length_ratio_high,181.5,False,0.0,0.234375,0.0,0.0,2
dictionary,fj->en,u,"i, the personal pronoun, as an abbrev. of au when that pronoun follows a vowel, as in e dina, seu lasu? that is true, or am i wrong? (commonly, one might see seu written as se ’u.)",too_short_or_empty|length_ratio_high,180.0,False,0.0,0.35135135135135137,0.0,0.02702702702702703,2
dictionary,fj->en,drama,"(eng.) n. theatrical play, in fij i mostly children ’s re-enactment of biblical stories done in a childish but funny way, often accompanied with much laughter. dau-ni-drama (ang.) actor, actress. drami, dramica v. to lick. gone dramidrami baby at toothless stage. drami-liga taste with the finger (j am, cake-icing). drami, dramica may apply to oral sex on a woman. idiom: drami toka i'll believe it when i see it happen, wait and see (sarcastic, when another makes assurances), sometimes accompanied by a gesture, like a cat licking the back of its paw. idiom: drami yame to tell tall stories, to tell fibs, lit. lick the lips. idiom: e drami nona vale lailai. he/she has a “runny stomach” (usually said of a child). implied is mucous fluid. idiom: dramica na vusi lit. the cat licked it up, meaning some food is so relished that it disappeared quickly, or something has been stolen secretly.",too_short_or_empty|length_ratio_high,178.6,False,0.0,0.23417721518987342,0.0,0.0189873417721519,2
dictionary,fj->en,co,"n. grass, small plant, herbaceous plant (not woody). co ca n. weed. covuata n. cereal grain such as wheat, rice, corn (maize), j acob ’s tears. (covuata would be rare usage, as by a technician in the agric. dept.) veico n. grassland. cocona (lau) overgrown, as of a garden. co, cova v. of a hawk, tern, frigate bird, to swoop down and carry off its prey.",too_short_or_empty|length_ratio_high,177.0,False,0.0,0.21212121212121213,0.0,0.0,2
dictionary,fj->en,dua,"bau just one. sa bau vakacava na teitei? just how is the garden ? a cava sa bau tukuna na boso ? just what did the boss say? o bau wili kina o iko. you are definitely included. there can an implication of once or ever, or in the negative, not once, never. o sa bau cakava ? have you ever done it? au a sega ni bau rogoca na yacana. i have never heard his/her name. au a sega sara ni bau moce ena bogi koya. i did not sleep at all that night. bau, bauta . v. to accompany, supportively, to do something, go somewhere together.",too_short_or_empty|length_ratio_high,175.0,False,0.0,0.19047619047619047,0.0,0.06666666666666667,2
