domain,direction,source_text,target_text,quality_flags,len_ratio,flag_duplicate,english_score_src,english_score_tgt,fijian_score_src,fijian_score_tgt,num_flags
dictionary,fj->en,are,"smaller and in texture are drier than white duruka . duruka is perhaps best cooked by grilling over embers, or simmered in coconut cream. also eaten raw, sliced in salads, by resident europeans. dusi, dusimaka v . to point (as with the finger), to indicate, point out. dusi, dusia v. to indicate, point, to point at. dusivaka vei koya na ka me kau mai. indicate to him the thing that is to be brought here. dusia na sala point the way (the path, or figuratively, the way to do something). syn. (west, rewa, kadavu, lau) duci.",too_short_or_empty|length_ratio_high,175.0,False,1.0,0.2872340425531915,0.0,0.0425531914893617,2
dictionary,fj->en,ke,"if. shortened form of kevaka. ke au o iko . . . if i were you . . . . ke o lako ki suva, ke drau sota kei mere, qai solia vei koya, kevaka e rawa if you go to suva and if you meet mere, give it to her, if possible. when ke follows kevaka in a sentence, ke means “would”, i.e. kevaka ko a tiko kina, ke o mate. if you had been there you would be dead.",too_short_or_empty|length_ratio_high,175.0,False,0.0,0.24,0.0,0.05333333333333334,2
dictionary,fj->en,idaba,"n. packet, coil (as of fij i tobacco, that is sold retail as a length of twisted coil, unrolled from a ball). daba, dabara (or) dabana v. to tie up a bundle, usually of homogeneous things, stacked together. dabe . adj . too soft, overly mature, of breadfruit. dabe . n. seat (in parliament); sitting (parliament). dabe, dabeca v. to sit, sit upon (chair etc), sit for (exam). dabe vakadodonu sit up straight. dabe e cake! sit up ! (on chair), said to respected fij ian visitor who is seated on floor. dabeca na ibe sit on the mat. dabe vakayalewa sit with both legs together, at one side, as women sit. dabe vakatagane (or) dabe vakatoga to sit cross-legged. as men sit. syn. (rewa) drata, dratava. dabe, dabera, dabelaka v. to set something down, parcel on the floor, pot on the stove. dabelaka may refer to sexual position, woman seated on top of the man in intercourse.",too_short_or_empty|length_ratio_high,174.4,False,0.0,0.24516129032258063,0.0,0.012903225806451613,2
dictionary,fj->en,ki,"tautuba go outside. na daku ni tuba n. outside the lagoon, outside the reef. gusu ni tuba n. local name for the lower reaches of the ba river. (gusu mouth). idiom: lasa e tuba have an affair outside of marriage. tube, tubea v. to hold in the hand, often said of offering a whaletooth. idiom: tube tabua to bring a presentation of whaletooth.",too_short_or_empty|length_ratio_high,170.5,False,0.0,0.25396825396825395,0.0,0.06349206349206349,2
dictionary,fj->en,i,"ra or e ra . below. e vei? i ra, ena ruku ni teveli. where? down below, underneath the table. the opposite “up” is e cake, ena dela ni teveli, above, on top of the table.",too_short_or_empty|length_ratio_high,170.0,False,1.0,0.2,0.0,0.14285714285714285,2
dictionary,fj->en,they,"stand still on the stones the feet are protected by a layer of green vegetation. these are special stones, considered sacred. one speculation is that a very thin layer of ash separates the stones from the feet, serving as a kind of insulation. firewalkers freely invite foreigners to join them, holding their hands to prevent a fall. this author has not accepted the invitation. vili, vilika v. to gather, of certain foods such as wi fruit, dawa, ivi (polynesian chestnuts), mature coconuts, mango, and mussels or small clams. mai vilivili! come, pick them up ! idiom: vili wi vakaca to be beaten by a large margin in some sport or game, lit. to gather wi fruit unsuccessfully.",too_short_or_empty|length_ratio_high,169.25,False,1.0,0.29310344827586204,0.0,0.0,2
dictionary,fj->en,may,"not be so relevant as many fij ians are pre-occupied with their lives in towns or other distant places of employment. to renew relations to one ’s village is cara sala to “clear or sweep the path” to the village. it can be an expensive process, requiring gifts of goods, and time spent. a fij ian ’s village is almost always demanding support. sala . n. by extension, sala may mean figuratively, the way or means (the path) to accomplish something, or may mean to extend, as in extending the hand or leg.",too_short_or_empty|length_ratio_high,168.0,False,0.0,0.3118279569892473,0.0,0.0,2
dictionary,fj->en,green,"skin. samuta na dawa to harvest dawa fruit by striking the branches, beating them to loosen and release the fruit which appears march through may . there has been a belief that double fruits may be offered to a woman to improve her chances of having babies. syn. (tonga, west, kadavu) tawa. idiom: kena na isamu ni dawa he/she suffered from someone else ’s actions. dawa, dawaca (or) dawaka v. to cross over (river, creek, road). e dua na dadawa a crossing (place to cross) but not usually a bridge, can be a ladder or step s up to a house. the verb applies in treeclimbing, to branches that allow one to cross to the next tree. sa dawa na mate the sickness is transmitted, infectious. vakadawa to transmit. vakadawa na itukutuku transmit the message. vakadawai-lago stay in the doorway, inadvertantly blocking it (bad manners). see dewa.",too_short_or_empty|length_ratio_high,167.6,False,0.0,0.2702702702702703,0.0,0.0472972972972973,2
dictionary,fj->en,savu,". (in measurement or counting) “and then some”. na vale oqo sa katu lima ka savu na kena balavu ka katu tolu ka savu na kena kubu. this house is five fathoms long and a little more, with a gable that is a little more than three fathoms. savu is an unspecified remainder, or an additional amount. savu, savuya . v. to rinse, splash water on (some part of the body, something) usually to clean it, using the hands. savuya na yavana. wash the feet. sasavui wash the feet. see sevu, sevuya, sevuka. idiom: vakasavu liga (anglicism) uninvolved, ineffectual, idle, wash one ’s hands of any responsibility . idiom: vakasavu itukutuku pour out a story, give a verbal report.",too_short_or_empty|length_ratio_high,166.5,False,0.0,0.22413793103448276,0.0,0.0603448275862069,2
dictionary,fj->en,kai,"kuku n. bivalve shellfish, mussel, mytilidae, generally modiola tulipa a specialty of the lower rewa river, supplying the suva market. the shell is often used to split pandanus leaves preparatory to matweaving. kuku is a place-name, and a name of a people in southeastern viti levu island. kaila, kailavaka v. to shout out loud, to yell. kailavaka yani vei koya. call out to him/her. kailavaki koya! yell at him/her ! kaikaila v. to shout loudly, as of a crowd. na ikaikaila the shouting. e levu",too_short_or_empty|length_ratio_high,165.0,False,0.0,0.27586206896551724,0.0,0.022988505747126436,2
dictionary,fj->en,livi,"(eng.) n. leave, vacation from a job. livi, livia v. to pour, usually a liquid from a container, small amounts, as from a teapot, a cup of tea, from a bottle, a glass of wine, carefully. some fijian water-pots had spouts from which water was poured into the mouth without the mouth touching the pot. the spout could be several inches distant from the mouth. livilivi v. to do the pouring, as of tea. liviraka v. to do such pouring roughly, carelessly. liwa, liwava v. to blow (of the wind), to blow at or over. na vanua e liwa mai kina na cagi where the wind comes from. liwavi blown over or at something. liliwa cold. wasaliwa ocean, sea (syn. wasawasa).",too_short_or_empty|length_ratio_high,163.75,False,0.0,0.3360655737704918,0.0,0.02459016393442623,2
dictionary,fj->en,yalu,"(archaic) n. ancient var. of yaqona, much prized for ceremonial presentations. the root is very large and grows horizontally in the ground, making it easy to harvest. yalu, yaluma v. to reach out the arm to grab, grasp (something). yaluyalu-lala v. to reach out to take, but fail, empty-handed. lala empty . yaluma . n., v . grief, to grieve, anguish, in agony, mental or physical. yaluma . v. (archaic) to retrieve, take, pass over to someone. usually heard as yaluma mai get for me, retrieve for me. yamaraka . v. to smash, knock down, as of a tree in a gale, a house in a hurricane. yamaraka . v. to beat up, give a beating to someone. syn. buturaka.",too_short_or_empty|length_ratio_high,163.25,False,0.0,0.29310344827586204,0.0,0.017241379310344827,2
dictionary,fj->en,isa,". n . a sudden frightening wind that strikes from one side, usually around september-october, near the sea on the main islands. blasts can recur or continue for several hours. in english this type of wind is sometimes called a cat ’s paw from its dangerous speed and power. isa . n. partner (marriage, tennis, business), mate, a necessary second of two things (one shoe out a pair of shoes), a gift made in exchange for another, a necessary opposite of two things, as with a rafter of a",too_short_or_empty|length_ratio_high,162.0,False,0.0,0.3218390804597701,0.0,0.0,2
dictionary,fj->en,donu,"correct, straight, exact. sa donu oqori that is correct. donu! correct ! okay ! e loma donu exactly in the middle. lima donu na kaloko exactly five o ’clock. tu donu straight ahead. vuki donu behaves correctly, obedient, of a child. see dodonu. donuya, donumaka v. to match (in many different senses), be level with , coincide in time or place, to meet up with, to correspond to, to be allowed or approved. sa donuya na basi o koya. he/she got on the bus on time. e donuya yani o koya na coqa oya. he/she was there at the time of that crash. veidonui to be opposite each other, correspond to each other, parallel. me rau veitaudonui na teveli",too_short_or_empty|length_ratio_high,160.5,False,0.0,0.2711864406779661,0.0,0.059322033898305086,2
dictionary,fj->en,ila,"n. boundary, border, as marked out in games, marbles, tennis, etc. laba, labata v. to murder. na laba the murder. daulaba murderer. beitaki ena laba accused of murder. cagilaba n. hurricane. cagi wind. labakara, labakarataka v. to attempt to murder (but fail). labasa! (slang) as an exclamation, a mocking reprimand for any revealing ab sence of clothing or disarray of clothing near the genitals. the implication is ""hot stuff !"", from the fact that labasa town has a hot climate.",too_short_or_empty|length_ratio_high,160.33333333333334,False,0.0,0.25316455696202533,0.0,0.012658227848101266,2
dictionary,fj->en,paini,"(eng.) n. pine (tree, timber). this usually refers to the introduced, fast-growing caribbean pine, pinus caribaea, now the basis of a major export industry in fiji. “paidar” (hindi) v . to walk. this is used especially by tailevu people who say (mixing english, fijian and hindi): “tailevu no leqa, no basi, paidar”. this means that in tailevu one can get around on foot when there is no bus. (the land is not mountainous.) “paisa” (hindi) n. money, a word well known to almost all fijians. “pakapaka” (hawaii) n. toothless fish , pristipomoides sp., some five species, distinctive yellow dorsal fins, highly prized by europeans and japanese, but as a deep-sea fish caught on line to depths of meters, unknown to early fij ians. length < cm. the french of vanuatu refer to the fish as “poulet”.",too_short_or_empty|length_ratio_high,158.8,False,0.0,0.2518518518518518,0.0,0.0,2
dictionary,fj->en,ta,"(or) ta-ta n . dad, daddy, as said by a child. see tama-na father. ta, tavaka v. to wait for, to meet and greet (person). ta, taya, talaka . v. to chop, cut forcibly. laki ta buka go chop firewood. taya na buka chop the firewood. taya na gaunisala cut the road. taya na waqa build the boat (""chop the canoe ""). na ta",too_short_or_empty|length_ratio_high,158.0,False,0.0,0.19047619047619047,0.0,0.07936507936507936,2
dictionary,fj->en,wa,"sara n. a wild edible corm, considered a yam, often eaten raw, especially by highlanders of colo east by my observation. this is probably the same as wa yaka. nai vola ni kau gives wa sara as the wainibuka name for wayaka, pueraria lobata, fabaceae. i believe the same name applies in colo east. see wa yaka below.",too_short_or_empty|length_ratio_high,157.0,False,0.0,0.27586206896551724,0.0,0.017241379310344827,2
dictionary,fj->en,na,"volitaki weleti the selling of papaya. volivolitaki n. marketing. dauvolivolitaki seller, salesperson, marketer. veivoli commerce, trade. isoqosoqo cokovata ni veivoli consumer cooperative. volivinaka to be a bargain. volica to be a bad buy. voli-rawarawa inexpensive. voli-saulevu expensive, pricey, “dear”.",too_short_or_empty|length_ratio_high,154.0,False,0.0,0.1951219512195122,1.0,0.024390243902439025,2
dictionary,fj->en,suva,"is the freshwater mussel from the wailevu (rewa river), batissa violaceae, much of that from around village kasavu, and some also from verata territory. canu kai, canuma na kai pick up, gather kai. qe, qeva na kai dig kai out with the hands. sili kai, silima na kai to wade (even neck deep) for kai. the small bamboo basket used for collection in the wailevu is referred to as ikata; it allows water to flow freely through it but retains the mussels. butu kai v . to feel for kai with the feet. gege na kai v. to open the kai. vali, valia na kai v. to separate the kai from the shell. ciciga na lewena v. to prise",too_short_or_empty|length_ratio_high,153.25,False,0.0,0.2966101694915254,0.0,0.05084745762711865,2
dictionary,fj->en,it,"lies to the south. e dua na yanuyanu lailai ka koto tikivi ovalau. a small island that lies next to ovalau. koto-ravita to lie next to, as a nearby location for something. in lau, koto is syn. with davo (to lie down, of a person or animal). in navosa koto means to sit (dabe in bauan). va-kotokoto-taka na",too_short_or_empty|length_ratio_high,152.5,False,1.0,0.3114754098360656,0.0,0.06557377049180328,2
dictionary,fj->en,may,"see this spelled o yau. o cei oqori? who is there? oi au. i (am there). oi au, au uma ni sa cala. as for me, i think it is wrong. fijians are less inclined to begin a sentence with a personal pronoun or a person ’s name than in the case in english. oiauwe! emotional exclamation of amazement, sorrow, regret, great fatigue. see iauwe. oilei! common interj ection with many meanings, surprise, regret, frustration, depending on the context and tone of voice.",too_short_or_empty|length_ratio_high,152.33333333333334,False,0.0,0.27710843373493976,0.0,0.024096385542168676,2
dictionary,fj->en,most,"years the trees are barren of fruit. in wet climate an anthracnose fungus also causes flowers to drop. like most fruits, the mango is often eaten by fijians when it is hard and semi-ripe. with a ripe mango, fij ians will usually bit a hole at one end and suck out the fruit. they refer to drinking such fruit, not eating it. they never peel a mango the way europeans do. varieties: tabua a large, curved fruit with distinctive red colouring. maqo loa a superb var. of finest flavour, brilliant green when unripe, turning darker and dusky when fully ripe. indians have special varieties for making pickles. for",too_short_or_empty|length_ratio_high,152.25,False,0.0,0.28440366972477066,0.0,0.0,2
dictionary,fj->en,as,"a fijian would often say in english, “in front”. gone liu head-boy (school). na toso ki liu the progress (the forward movement). yavu-tu ni toso ki liu so-called peoples’ charter as established under interim pm voreqe bainimarama. idiom: o ira sa liu yani those who have already died (gone on before us).",too_short_or_empty|length_ratio_high,152.0,False,1.0,0.14545454545454545,0.0,0.03636363636363636,2
dictionary,fj->en,te,"n. foamy scum found on the surface of coastal waters some days before the rising of the balolo seaworm (an annelid, palolo viridis), which will be gathered as food. when the scum is sighted, locals stay alert to the arrival of the worm. the rising usually occurs twice a year, october (balolo lailai) and",too_short_or_empty|length_ratio_high,152.0,False,0.0,0.3333333333333333,0.0,0.0,2
dictionary,fj->en,ni,"gone (""bringing the children's face”). today the tendency is to bring several siblings at the same time, often waiting for years till some of them are virtual adults. the children must not be seen at the village until the ceremony is performed. na cauravou oqo e vasu ki bau. this youth ’s mother is from",too_short_or_empty|length_ratio_high,152.0,False,0.0,0.32727272727272727,1.0,0.03636363636363636,2
dictionary,fj->en,be,"lavo, and if he is lavo they will be tako. the tako and lavo could have different totems. a person may be addressed by his/her classification tako or lavo. in a few locations colo tribes have brought the custom down to the lowlands in ba, for example, and in parts of ra. the social custom has eroded in",too_short_or_empty|length_ratio_high,151.5,False,1.0,0.3728813559322034,0.0,0.0,2
dictionary,fj->en,buli,"n. traditional title of certain chiefs (followed by a place-name), macuata, bua provinces, a title borrowed by colonial administration for the government fij ian official administering each old district (tikina makawa), discontinued for a time after , replaced by district commissioners of united provinces. later the smaller old districts were re-instated, and the united districts discontinued. buli, bulia v. to form, shape, create, manufacture. buli vacu v. to form a fist, clench the fist (as for punching). talanoa buli fictional story. ibuli madrai loaf of bread. ibuli kasivi glob of spit. ibuli",too_short_or_empty|length_ratio_high,150.75,False,0.0,0.24731182795698925,0.0,0.0,2
dictionary,fj->en,ni,"viti is added only if there might be confusion with modern baked bread. the starch-foods may be breadfruit, taro, kawai, arrowroot, polynesian chestnut ivi, plantain vudi, sweet potato kumala, cassava, or via. fruits used may be those of malay apple kavika, or even the mangrove dogo kana (especially",too_short_or_empty|length_ratio_high,150.0,False,0.0,0.16326530612244897,1.0,0.0,2
dictionary,fj->en,biri,"adj . bulging, of body veins, muscles, usually from exertion. biri, biria, birika v. to set, prop up, of a snare to catch birds, pigs; set open, of umbrella, mosquito net. birika implies more force. b irika na nomu taunamu. open up your mosquito net. bisa, bisa . v. to complete something difficult. bisa, bisa . v. to fall suddenly, to pour down, of rain usually but could apply to mud in a landslide, or anything that flows. bisa to rain on something. bisa, bisa . v. to arrive, come or occur suddenly (not a common expression). au bisa ga yani na nona lako tiko. i just arrived as he was going.",too_short_or_empty|length_ratio_high,149.25,False,0.0,0.2222222222222222,0.0,0.037037037037037035,2
dictionary,fj->en,be,"let to fly free and the males especially, will return to a person who has fed them. they eat fruit of baas, papaya, the sa tree, kavika tree, and flower shoots of the yaqoyaqona. they have excellent vision, and sense of smell but cannot echo-locate, as the smaller, insectiverous bats do, who live",too_short_or_empty|length_ratio_high,148.5,False,1.0,0.2962962962962963,0.0,0.0,2
dictionary,fj->en,sara,"n. small silver edible fish, atheridinae sp., that schools seasonally close to shore, often used as bait by commercial fishermen. schools scatter when disturbed and may regroup elsewhere. levuka people are sometimes jokingly referred to as bati sara, intimating that sara is one of their favourite foods. sara, sarava v. to look, to gaze at. sarasara ga just looking (with no other intention), browsing (shopping). vale ni sarasara n. stadium for spectators (for sports functions). siga ni sarasara open day, for the public to visit, as at some public institutions, university, mental hospital.",too_short_or_empty|length_ratio_high,148.5,False,0.0,0.24731182795698925,0.0,0.03225806451612903,2
dictionary,fj->en,dia,"(eng.) deer, now also often a term of affection, dear. deer were introduced to wakaya island but nowhere else in fij i. the fij i army was asked to cull their numbers very severely. as in new zealand, they damage natural vegetation. dia, diaka v. to throw knife (handle first). diaka na vunikau to throw a knife at the tree. veidia children's game, throwing knives into ground. anciently, hard reed-stems were used before knives were introduced.",too_short_or_empty|length_ratio_high,148.33333333333334,False,0.0,0.2857142857142857,0.0,0.012987012987012988,2
dictionary,fj->en,sai,". n. see saisaia. “saijan” (hindi) n. drumstick tree, moringa oleifera, moringaceae, introduced. leaves and fruit used as cooked vegetables, and as folk medicine, by indians. the drum-stick shaped fruit is often sold in the market. excessive rain reduces fruit-set. extracts from the plant have effects that are anti-microbial, ease muscle spasms, and reduce blood pressure in experimental animals. saini, sainitaka (eng.) v. to sign (it).",too_short_or_empty|length_ratio_high,146.33333333333334,False,0.0,0.25,0.0,0.0,2
dictionary,fj->en,drisi,". adj . as in mata drisi, having haggard features or complexion, often with bloodshot eyes. this is thought to be from poor life-style, such as excessive drinking, staying up late at night. drisi . n., v. to whistle sharply , as if to attract attention, like the call of the kula, the collared lory, phygis solitarius. in various parts of fiji the kula bird is referred to as the drisi (or) drusi. formerly it was valued for the red feathers, especially by tongans who collected it in fij i, especially for trading to samoa. tongans engaged many fij ians in this effort. driti, dritia . v. to cut off (cloth from a roll of cloth), tear off (leaves of a plant, usually for food or medicine). e dua na isulu driti a length of cloth.",too_short_or_empty|length_ratio_high,146.0,False,0.0,0.3409090909090909,0.0,0.015151515151515152,2
dictionary,fj->en,kubu,"v. to flee. veikubuyaki to run off in all directions. kubu! take off ! run ! escape ! kubu, kubuta . v. to fill the cheek s out with something (like water, food). sometimes to swill it as in tasting wine or gargling. modernly, the word can become vulgar, referring to oral sex on a male. kubu, kubuta . v. to remain silent, concealing some thought, feeling, keeping it to oneself. kubukubu v., n. to gargle, gargling, rinse the mouth, as in morning ablutions. kubukubuta to gargle with something, such as a mouthwash, or cagolaya, a species of ginger used to ease throat colds. dredre",too_short_or_empty|length_ratio_high,146.0,False,0.0,0.28,0.0,0.0,2
dictionary,fj->en,is,"charged for sighting them and one is told of the prohibitions: no touching, taking, and no photographs. the ritual call: “ ‘eitou qo na marama ni vuna, ‘eitou mai via sara ura buta. e tuba, e tuba, e?” this is said to recall that people here supported the tui wairuku in aiding the tui cakau",too_short_or_empty|length_ratio_high,145.5,False,1.0,0.25925925925925924,0.0,0.09259259259259259,2
dictionary,fj->en,so,"na ua . daffy, said of a person who by nature responds in unexpected ways that amuse others. literally, in vanua levu, so na ua means the tide is full. sa so mai na ua. the tide is rising. in tailevu, mati ruku means low tide (usually referring to the early morning), which has taken on the",too_short_or_empty|length_ratio_high,145.0,False,0.0,0.26785714285714285,0.0,0.05357142857142857,2
dictionary,fj->en,gone,"biu vuli school-leaver. gone tubutubu adolescent child. gone dramidrami baby at nursing stage. na itabagone the young generation (children). gone ni toko pampered, favoured child. idiom: tamata vagone person who has a devil (tevoro) who is served (as in pouring yaqona in tribute) in return for favours that are usually evil. conceptually , looking after the devil is as looking after a child, requiring attentive care but it is dangerous if duties are neglected. syn. vakatevoro. idiom: gone turaga (or) gone marama respectful reference to a chief, male turaga or female marama.",too_short_or_empty|length_ratio_high,144.75,False,0.0,0.21739130434782608,0.0,0.021739130434782608,2
dictionary,fj->en,ulavi,"n. parrot fish , mainly scarus harid, dull reddish colour, but several species at the reef, edible. in various places, this name applies to bolbometopon spp. uli, ulia, uliraka . v. to stir, as of sugar in tea, milk powder and water. uliraka to stir fast, forcefully, as in whipping eggs. na iuli n. stick or spoon used to do the stirring. uli, uliva . v. to comment on a speech when it is finished, often summarising and complimenting the speech in ceremonial reception of it. uliva na noqu vosa to receive respectfully and comment on my speech. uli, ulia, uliva . v. to steer (a boat, vehicle). uliva na waqa ki na matasawa to steer the boat toward the shore. ulia na motoka to steer the motor car. iuli n. rudder, helm.",too_short_or_empty|length_ratio_high,144.4,False,0.0,0.27906976744186046,0.0,0.03875968992248062,2
dictionary,fj->en,saga,"his/her effort. tamata sasaga n. striving person, person who tries hard. saga, vakasaga v. to tease, harass, persecute, cause trouble for someone. vakasagai teased, harassed, persecuted. saga-ca-taka v. to molest, harass; there can be sometimes an implication of witchcraft. sagale n. common at mangrove edge and coastal strand, lumnitzera littorea, combretaceae, often used for firewood, sometimes for building. bark mud-grey, fissured, peeling in thick flakes, revealing light grey patches. slash orange, then yellow wood. the timber is superior to the common mangrove trees",too_short_or_empty|length_ratio_high,144.0,False,0.0,0.1724137931034483,0.0,0.0,2
dictionary,fj->en,is,"spawning. young sharks (bulubulu) now born, swimming close to shore, and sharks more inclined to bite. this is the rich dere neke time of the land crab (lairo) especially the lairo vula . in some areas the balolo may appear. the fish walu and the crevally (saqa) are breeding their young.",too_short_or_empty|length_ratio_high,144.0,False,1.0,0.32,0.0,0.0,2
