domain,direction,source_text,target_text,quality_flags,len_ratio,flag_duplicate,english_score_src,english_score_tgt,fijian_score_src,fijian_score_tgt,num_flags
dictionary,fj->en,su,"(ni radini ni bau). very similar to rosi loa, timor snapper, l. timorensis, which has slightly darker red back and fins. roso, rosova v. to squat on one’s haunches, sit on one ’s heels, for convenience or from respect for the presence of important people.",too_short_or_empty|length_ratio_high,127.5,False,0.0,0.21739130434782608,0.0,0.043478260869565216,2
dictionary,fj->en,money,"or “loans” from others around him, loans which might be difficult to repay . with a twist of irony, it is said that a fijian ’s life is full of leqa -- until he himself becomes the leqa, by dying. idiom: kua ni leqa. not to worry. don ’t worry about it. leqa, leqataka v. to worry about it. leqataki troubled. kua ni leqataka. don ’t worry about it, do not go to any trouble. vakaleqa, vakaleqa v. to cause trouble to (someone). me kua ni vakaleqai au. do not be a problem to me, make problems for me. lera n. red-bead tree, adethera pavonina, mimosaceae, possibly an aboriginal introduction with red seeds commonly made into necklaces.",too_short_or_empty|length_ratio_high,127.2,False,0.0,0.28448275862068967,0.0,0.05172413793103448,2
dictionary,fj->en,dewa,"n. (anglicism) a newly invented word for a suffix attached to the root-form of a verb (vu). for example, with the root-word for “hit or strike, club or kill” moku, one may attach a suffix to create the transitive form, as in moku-ta to hit it/him/her. such innovative words are thought useful by some language teachers. dewa, dewava v. to catch, spread, as of a disease. matedewa n. infectious disease. na dewa ni mate the spread of the sickness. na veidewavi the transmitting (as of disease), the infecting.",too_short_or_empty|length_ratio_high,127.0,False,0.0,0.3333333333333333,0.0,0.03225806451612903,2
dictionary,fj->en,e,". particle that may appear in front of numbers, or quantities: e tolu three. e so some. e so tale some more. e vica ? how many?",too_short_or_empty|length_ratio_high,127.0,False,0.0,0.12,1.0,0.16,2
dictionary,fj->en,not,"the fruit. on viti levu more commonly called kau damu from the reddish colour of the sap and wood. also the aril, a gelatenous, brilliant red covering of the nut, inside the yellowish husk. one of the species closely resembles the commercial nutmeg species, but it lacks fine fragrance and taste. the introduced true nutmeg is planted as a commercial crop only at wainadoi, namosi.",too_short_or_empty|length_ratio_high,127.0,False,0.0,0.3384615384615385,0.0,0.0,2
dictionary,fj->en,mana,". v. to come about, good result or good fortune, fulfillment, usually from some action or some thing that can happen. there is an implication of magic or supernatural effect. for example, some fijian villages have destroyed or turned over to the methodist church their old fijian artefacts (clubs, spears, yaqona bowls) that pre-dated christianity . they expect or hope that some good will come from that, such as, perhaps, better success for their children in school, or more good fortune for their village.",too_short_or_empty|length_ratio_high,127.0,False,0.0,0.27710843373493976,0.0,0.0,2
dictionary,fj->en,tu,". v. to have. sa tu vei au e dua. i have one. tu ga e lomana have thoughts, feelings kept to oneself, unexpressed, where open expression of opinion would be considered intrusive or rude. it is not customary to express opinions in front of someone senior.",too_short_or_empty|length_ratio_high,127.0,False,0.0,0.21739130434782608,0.0,0.06521739130434782,2
dictionary,fj->en,votu,". v. to appear, become visible. e votu mamaca it appears clear(ly). e laurai votu it is clearly visible, apparent. geraghty believes this is the origin of the place-name votua, suggesting a location that has appeared after a lowering of the sea level or a rise in the level of the land. votu . n. vowel. this word is a modern invention of teachers of fijian language, unknown to the general public. similarly, the new fij ian word koso has been invented to mean “consot”. and tago-na refers to “syllable”.",too_short_or_empty|length_ratio_high,126.25,False,0.0,0.34065934065934067,0.0,0.03296703296703297,2
dictionary,fj->en,will,"be revealed if the sand is disturbed (and the sand itself is thought to have salt). theft can be a common problem since the planted vacina is perfectly edible. a hand can easily dip into soft earth of the planted mound. without the disturbed sand, the farmer might wait in vain for his harvest from the empty mound. uvu, uvuca v. to blow out air or tobacco smoke from the mouth or nose. me uvu na sici! blow the whistle ! (whistles were known anciently in colo west, now displayed in the museum, though",too_short_or_empty|length_ratio_high,125.5,False,0.0,0.3225806451612903,0.0,0.021505376344086023,2
dictionary,fj->en,nawi,"island in nasavusavu harbour. his was some bamboo that afterwards began to grow on the island, according to legend. reputedly, it is still there today. ovi, ovica v. to brood (female birds, usually), take under the wing. it is perhaps by ext., that this may refer to covering up a child to keep it warm. idiom: viavia ka-ovi (lau) to posture pretentiously, as an older man who pretends to be attractive to young girls, or a person who shows off (wealth, respected position) that is clearly pretense.",too_short_or_empty|length_ratio_high,124.75,False,0.0,0.3409090909090909,0.0,0.011363636363636364,2
dictionary,fj->en,nama,"n. sea grapes, a seaweed (lumi), caulerpa racemosa, common food found at the seashore, rich in iron, low in other nutrients. specialties at ucunivanua, verata, koro island, and nabukelevu-ira in kadavu. sold at the suva markets, usually with a large red chilli (an introduced condiment) and a fermented coconut seasoning called kora or kota . delicious eaten raw, sometimes served with miti or lemon juice, which is a tongan introduction. commonly it is accompanied by fish or shellfish. it",too_short_or_empty|length_ratio_high,122.5,False,0.0,0.27848101265822783,0.0,0.0,2
dictionary,fj->en,diva,"v. to long for, desire (person, home, a certain food) with nostalgia often implied. au diva meu lako. i wish i could go. au diva na noqu daulomani i long for my beloved. au diva na veigauna sa oti i miss the old times. na veigauna divi the times remembered. e dua na gauna divi a time to be remembered, an unforgettable time. au diva lo voli me . . . i secretly dream that . . . na kena idivi n. that which is desired, dreamed of. idiom: wai ni diva, sega ni kabita tears of futile desire.",too_short_or_empty|length_ratio_high,122.25,False,0.0,0.23655913978494625,0.0,0.10752688172043011,2
dictionary,fj->en,damp,"ground, and may be found at the suva market (march) but fruits and flowers throughout the year. inflorescence large, showy, pendant, with long white stamens tinged pink. fruits oblong to cm long, ripens to dark green or purple green, with persistent calyx, syn. vala (old oceanic name, lau, macuata, west., kadavu), and in melanesian english “cut nut”. care must be taken not to confuse it with a somewhat similiar looking poisonous species, vutu ni wai or vutu gaga b. racemosa. the fruit",too_short_or_empty|length_ratio_high,122.25,False,0.0,0.21951219512195122,0.0,0.012195121951219513,2
dictionary,fj->en,claw,"(or a crab), or fist of a person, or eyebrow of a person. sa momona na qari. the sea crab is “full”, in season. sa tawa na qari. the sea crab is full of flesh. sa lala na qari. the sea crab is empty of flesh. leuta mai na lewena. hook out the flesh. lawasua (or) lawaicua trap for sea crab. vakasoso n. sea crab flesh removed, then replaced in crab shell, cooked with coconut cream, a specialty of lakeba island (not to be confused with vakasoso pudding that is a sweet starch-food.) syn.",too_short_or_empty|length_ratio_high,122.0,False,0.0,0.2736842105263158,0.0,0.042105263157894736,2
dictionary,fj->en,pawn,"shop, to divorce (of married couples). na veisere n. the divorce (of a married couple). viebiu v. to be separated (of a couple). n. former spouse. sere dali v., n. to let go the mooring (usually of a boat). idiom: sa sere na koli. literally, the dog is let go (off the leash), but by extension referring to people suddenly freed from restriction or discipline who may act a little wild. sere, sereka, serelaka . v. to reveal in detail, set out the details in an explanation, to explicate.",too_short_or_empty|length_ratio_high,122.0,False,0.0,0.29545454545454547,0.0,0.022727272727272728,2
dictionary,fj->en,is,"a benign or indifferent creature, certainly not threatening. (kalou spirit, gata snake.) modernism: mo kalougata tiko! be happy ! see degei, legendary immigrant chief, later a sacred spirit. kalou-gata . n. good fortune, happiness, blessings.",too_short_or_empty|length_ratio_high,121.0,False,1.0,0.08823529411764706,0.0,0.058823529411764705,2
dictionary,fj->en,li,"a particle giving emphasis to a question or statement, sometimes with rhetorical implications. “really” might be one translation. it cannot always be translated as a separate word. na cava li o via kainaka ? what is it you really want to say?",too_short_or_empty|length_ratio_high,121.0,False,0.0,0.3170731707317073,0.0,0.024390243902439025,2
dictionary,fj->en,nikua,"today, in recent times, these days. syn. edaidai. idiom: ki namuka vata ga nikua. we will all get there at the same time, lit. we will all reach namuka today. it makes no difference if one travels one way or another. the result is the same. nima, nimata v. to bail (water from a boat). inima n. bailer, bailing cup or bucket. idiom: tu na inima, ka luvu na waqa. the solution (to a problem) was at hand but nobody thought of it, lit. the bailer was there but the boat sank. idiom: waqa nimanima n., adj . an enfeebled person, lit. a leaking boat that requires constant bailing, thus feeble, ineffectual.",too_short_or_empty|length_ratio_high,120.6,False,0.0,0.22522522522522523,0.0,0.036036036036036036,2
dictionary,fj->en,as,such). sa daumaka na draki. it is pleasant weather. sa daumaka na nona igu. his/her enthusiasm is delightful. daumaka! lovely ! perfect ! great ! na masima e vaka-daumaka-taka na ikanakana ni kakana. salt makes the taste of food delightful.,too_short_or_empty|length_ratio_high,120.0,False,1.0,0.125,0.0,0.15,2
dictionary,fj->en,iwewe,"ni gusu-na idiom, as in: sa iwewe ni gusumu. you are always talking, thinking only about it/him/her. something has impressed or fascinated the person, focussing their attention. wi n. a semi-cultivated tree-fruit, to altitude meters, and thus unknown to highlanders in early times, spondias dulcis, anacardiaceae, relished by fijians, fruiting around april, may, august to december. fls small, white. probably aboriginal introduction. firm fleshed, it is too sour for most europeans. the very firm, yellowish flesh is sweet only very close to the prickly kernel. skin of the fruit remains green",too_short_or_empty|length_ratio_high,118.8,False,0.0,0.25,0.0,0.03125,2
dictionary,fj->en,na,"bulu yava round of yaqona served after departure of guest, when last comments and memories will be discussed. memories may then be set aside. ititoko, last cup before a person quits the session of yaqona drinking, lit. a walking stick.",too_short_or_empty|length_ratio_high,117.5,False,0.0,0.225,1.0,0.0,2
dictionary,fj->en,daiga,"n. indigenous wild plant that emits putrid odour when flowering, amorphophallus campanulatus, araceae, found from india throughout the pacific to the marquesas. reasonably well known around the coast. edible part is the round corm (” wide by ” to ” high, weighing about lb) with a depression on top from which the flowering shoot grows compactly. the mother plant dies back as the sprout emerges beside it. daigai is harvested after the leaf has died back and the plant is dormant. the corm is poisonous when raw. grated and cooked, it is believed to aid fermentation of a fijian storage",too_short_or_empty|length_ratio_high,117.4,False,0.0,0.3402061855670103,0.0,0.0,2
dictionary,fj->en,rats,"have caused serious depradation of birds that nest on the ground, including the aboriginally introduced jungle fowl. (i am indebted to paddy ryan for most of these notes.) kalavo . n. (slang) prostitute. kalawa, kalawaca v. to step, step over. kalawaca na ikelikeli step over the ditch. e kalawa ga vakavica . he took just a few step s. syn. lakawa. by ext. kalawaca to omit, to skip, or to pass over, improperly but perhaps inadvertantly, some item or some person(s).",too_short_or_empty|length_ratio_high,117.0,False,0.0,0.25,0.0,0.0375,2
dictionary,fj->en,cola,"isau back-up, enforce chiefly authority. keitou colacola oqo ? we are going to carry all this (on our shoulders)? idiom: e dua ga na siga ni cola qele let ’s try hard and finish up this work, we can finish it today, lit. it is only one day of carrying soil. idiom: cola vatu traditional obligation, bringing many gifts to the village after a long absence. because of this heavy expense, some villagers living away may have to delay their return to their home village.",too_short_or_empty|length_ratio_high,116.75,False,0.0,0.25882352941176473,0.0,0.047058823529411764,2
dictionary,fj->en,sova,"n. practical, utility-basket woven of coconut-frond leaves or more carefully from vilawa, usually for carrying food, cooked or raw. by extension, a bird nest. sova v. to flock about, as with flies, bees, children. sa sovi koya na namu. the mosquitos flocked about him. sova, sova (or) sovara v . to pour out, dump out, usually with brusk motion, quantities of liquid, or rubbish, or things that occupy a container. sovara na simede pour out, dump out the cement. sa",too_short_or_empty|length_ratio_high,116.25,False,0.0,0.20987654320987653,0.0,0.024691358024691357,2
dictionary,fj->en,latui,"n . fiji goshawk, accipiter rufitorques., endemic. syn. tuitui, waituitui. (west, namosi, colo east) reba. pink collar and breast; juveniles with speckled, streaked white breasts. docile disposition except when defending nest. lau, lauta . v. to pierce, to prick deeply with something that is sharp, pointed, a spear, a needle. idiom: lauti koya na sui ni kena he got caught in his own trap, he did it to himself. lit. the fish-bone from his own food pierced him. (sui bone) lau, lauta . v. to strike with the fist, a club, stick, stone that is thrown. can have figurative meaning,",too_short_or_empty|length_ratio_high,116.2,False,0.0,0.22448979591836735,0.0,0.02040816326530612,2
dictionary,fj->en,who,"then dispersed down the wainibuka river, reaching rewa, with one branch settling on bau island, the others scattered. the twins disappeared but have been claimed to reappear, or be about to reappear at various occasions. the notion of a return persists still today. it has sometimes been thought they will bring great riches in cargo cult fashion.",too_short_or_empty|length_ratio_high,115.66666666666667,False,0.0,0.3157894736842105,0.0,0.0,2
dictionary,fj->en,mona,"n. brain. na noqu mona my brain. the brain was never considered a specially important feature of personality, intelligence, or body function. it was eaten by cannibals. mona-taka v. to think up a plan, project. this is a modernism, as is mona livaliva n. computer, though a fijian is more likely simply to say the english word “computer” with fijian pronounciation. idiom: vesu mona! exclamatory humorous rejoinder in response to someone’s excessive flattery or",too_short_or_empty|length_ratio_high,115.25,False,0.0,0.2894736842105263,0.0,0.013157894736842105,2
dictionary,fj->en,vosa,"v. to speak. vosa vei koya speak to him/her. vosa taladrodro speak fluently, flowingly. vakalutu vosa v., n. to wisecrack. veisau vosa v. to talk back . na vosataki ni noda vosa the speaking of our (many) language. idiom: vosa tagau dua speak briefly, lit. speak just the short length of one internode (as of bamboo, or yaqona); toward the end of a speech, the speaker may say “tagau dua . . .” meaning “in brief” or “in summary” and summarise his main points.",too_short_or_empty|length_ratio_high,115.0,False,0.0,0.2222222222222222,0.0,0.024691358024691357,2
idiom,fj->en,kana yava ni toa,"[Literal Translation:to eat chicken feet] [Meaning:Your authority is effective in your territory (Vanua), but is irrelevant here in this territory. Each can be a chief in his own land. U 1. were ubiubi Literally translated as “to fake the work of cutting grass, weeds, by just knocking vegetation down to lie against the ground.” Meaning: To pretend to work. This idiom may imply that someone is not telling the whole story, that they are concealing some truth. 2. Sega ni ura me sa tei damu . Literally translated as “no prawn just turns red (unless someone has cooked it.” Meaning: Where there is smoke there is fire. The truth will come out. There must be a cause for something to happen, and the truth will be known. V and Y 1. vaka e vidi na ura Literally translated as “like a prawn springing into action.” Meaning: It conveys the notion of something that jumps suddenly into action, as the prawn does. 2. Sa viritaki na kena vatu . Literally translated as “a stone has already been thrown at it.” | It is already decisively rejected. Can also mean that the decision has been made to quit something, such as a game. A child may spit on a stone and throw the stone into the bushes to indicate that he is quitting a game. The notion is that if you found the stone he would be forced to stay 3. veivunauci vaka i Ra kasala . Literally translated as “to give advice as a kasala fish does” Meaning: You are good at giving advice but failing to follow that advice yourself. 4. Sa suasua na yavamu . Literally translated as “Your legs are still wet” This implies that you are new to this place, having just arrived ashore. You are a newcomer here and should not speak with assurance. 6. Yavita dole na mataisau Literally translated as “to club the carpenter prematurely.” | To judge a job prematurely before the work has been completed.]",has_digits|length_ratio_high,114.75,False,0.0,0.35714285714285715,0.25,0.024844720496894408,2
dictionary,fj->en,is,"expensive to rent punts with outboard motors, or trucks for the roads that now penetrate the highlands of viti levu. ibilibili . n. portion of feast food shared out. it is placed out, often pushed there (as implied by the word),",too_short_or_empty|length_ratio_high,114.0,False,1.0,0.325,0.0,0.0,2
dictionary,fj->en,gaga,". adj ., n. poison, poisonous, toxic, polluted. vakagaga na wai to pollute the water. vakagagai polluted. wainimate gaga ni veivaka-mateni-taki intoxicating drugs (mateni intoxicated). e na rawa ni ko ni gaga kina. it is possible that you could be poisoned by it. e rawa ni vagagai ko ira na dau kania. people who usually eat it could be poisoned. in ancient times fij ians used at least three species of plant as poisons to be consumed by their enemies.",too_short_or_empty|length_ratio_high,113.5,False,0.0,0.2375,0.0,0.1125,2
dictionary,fj->en,lamu,"adj . of a container or vessel, pipe or tube, has one or more holes, leaky. as an idiom applied to people, lamu (or) lamulamu means cowardly, fearful. it refers to involuntary urinating and defecation of a terrified person. a slang synonym is “fifty cents”, suggesting a round and open rectum. the english words are spoken within the fijian sentence, or used as an exclamation on their own. lamu, lamuta v. to push or knock one or more holes in a vessel.",too_short_or_empty|length_ratio_high,113.5,False,0.0,0.2962962962962963,0.0,0.0,2
dictionary,fj->en,p i,"hornet nest. bure ni oni beehive. bure kalou (archaic) traditional temple, lit. “spirit house”. idiom: tiko e bure to get circumcised with ritual stay at home for days for healing, for boys, formerly in a separate house, isolated from women. the same term is used for girls staying home at her first menstruation. one also hears tu i bure.",too_short_or_empty|length_ratio_high,113.0,False,0.5,0.23728813559322035,0.0,0.05084745762711865,2
dictionary,fj->en,ua,". n. wave, tide. uaua adj . slight, of the sea. vakaua adj . moderate, of the sea. ua lokaloka tidal wave, tsunami. see sonaua. ua levu high tide. sa lo na ua. it has become the quiet period just before change in tidal flow.",too_short_or_empty|length_ratio_high,112.0,False,0.0,0.16666666666666666,0.0,0.023809523809523808,2
dictionary,fj->en,due,"to shape of the leaf and also the yellow sap. bark is dark brown to black. branches straight, horizontal. prop roots at base of trunk. fls throughout the year, white to yellowish, pink to red at later stage. fruits red at maturity. syn. buliwai, (vanua levu) bulumaga which has clear sexual indications (maga vagina). (vuda, ba) sueri.",too_short_or_empty|length_ratio_high,111.66666666666667,False,0.0,0.24561403508771928,0.0,0.0,2
dictionary,fj->en,dreke,"n. large cavity (diverse applications). dreke ni wai n. mouth of the river. dreke ni waqa n. hold of the ship, where the cargo is loaded. dreke bi overloaded, very heavily loaded, usually of a boat. dreke, dreketa v. to carry on the back (of person or animal). sa dreke bi na ose. the horse is carrying a heavy pack. idrekedreke burden carried on the back (food, firewood, soldier's knapsack , pandanus leaves for weaving). dreketi carried on the back, a term used as a place-name in rewa and macuata. this is usually a woman ’s way of carrying heavy things.",too_short_or_empty|length_ratio_high,111.6,False,0.0,0.2871287128712871,0.0,0.0297029702970297,2
dictionary,fj->en,doce,"adj . outspoken in unhibited manner, overly candid, lacking respectful behaviour, mostly from being naïve, awkward, immature, daffy, having an unguarded nature. sa doce tu na nona ivakarau. his/her behaviour is lacking in proper manners. dodo, dodoka v. to extend, stretch out (arm, legs), lie down in extended position (person), lay out (as of voivoi leaves on the ground, to be cured in the sun) vakadodo stretch (oneself), as on waking up. lai",too_short_or_empty|length_ratio_high,111.5,False,0.0,0.24324324324324326,0.0,0.02702702702702703,2
dictionary,fj->en,vuci,"n. taro garden under natural irrigation, often swampy but where the water moves, even if slowly. the taste is considered better than that of dryland-cultivated taro. anciently there were in a few places elaborate irrigated terraced taro gardens. just a few were in use when europeans first arrived. vucu v. to chant. dau ni vucu (or) vu ni duvu composer and choreographer who creates traditional dances (meke), a position of great local respect.",too_short_or_empty|length_ratio_high,111.25,False,0.0,0.21621621621621623,0.0,0.02702702702702703,2
dictionary,fj->en,bui,"n. grandmother, respectful form of address for a woman who has reached upper middle age, or is elderly. it may also be a nickname for a child who is named after the older woman. similarly, a small boy may be referred to as tukai, grandpa, if a grandfather is his namesake. idiom: na nomu bui your wife (said to a man of mature age).",too_short_or_empty|length_ratio_high,110.66666666666667,False,0.0,0.328125,0.0,0.015625,2
dictionary,fj->en,gau,"n. major or principal section or part of something, mid-section, suggesting large size. gaunisala roadway, path . gau ni vosa main body of a speech . gau ni kau chunk of wood. gau levu big bodied, stocky (person, animal). syn. tolo-na. idiom: gau kau beat someone with a stick. in jocular j ibing with a person from gau island, one",too_short_or_empty|length_ratio_high,110.33333333333333,False,0.0,0.16666666666666666,0.0,0.05,2
dictionary,fj->en,taga,"n. sack, bag or pocket (of pants, shirt, coat). pants, shirts, coats and pockets are of course, modern concepts. sulu vakataga men ’s tailored skirt with pockets, invented by ratu sukuna. taga p ep a paper bag. taga niu bag of coconuts (or copra). taga ni niu bag for copra. indigenously, in earlier times, fijian men used baskets but no bags or pockets. tagana v. to put things in a bag. tawana ena taga to fill a bag, put things in a bag.",too_short_or_empty|length_ratio_high,110.0,False,0.0,0.20481927710843373,0.0,0.012048192771084338,2
dictionary,fj->en,ikalu,"n. whistle. formerly carried by some chiefs in the western highlands of viti levu, attached to a cord around the neck. no certainty as to the function of those whistles. kama, kamaca n., v. to fire, burn, scorch (may refer to sunburn). wai kama hot spring, hot acid (sulphuric, hydrochloric). kama bula wild fire, hot fire, still burning, spreading. kama bulabula burn alive. kama mate burned to death. kama yavu burned to the ground. vosa ni vakamakama inflammatory words, speech. vakama, vakamaca v. to set fire, burn it. vakama tamata cremate. e",too_short_or_empty|length_ratio_high,109.6,False,0.0,0.1956521739130435,0.0,0.021739130434782608,2
dictionary,fj->en,au,"run to me (words of a popular song). dro vua run to him. idiom: dro bula get out alive, survive. idiom: o sa dro tiko ena loma ni yaloka. you can't get away (just running around in circles), lit. run away inside an egg.",too_short_or_empty|length_ratio_high,109.5,False,0.0,0.1590909090909091,0.0,0.06818181818181818,2
dictionary,fj->en,bito,"(west) n. clan, or extended family . syn. for extended family: tokatoka in central and parts of eastern fiji. (lau) batinilovo. in the west, the earlier immigrants (before arrival of the nakauvadra people) had no concept of tribe yavusa.. the western bito or beto corresponds to the highlanders’ bure, essentially a clan or large extended family, the key kinship unit. in the highlands these adult men all lived together in their bure.",too_short_or_empty|length_ratio_high,108.75,False,0.0,0.2676056338028169,0.0,0.0,2
