domain,subdomain,source_id,book,chapter,verse,source_lang,target_lang,direction,source_text,target_text
bible,genesis,bible|genesis|028|013,genesis,28,13,en,fj,en->fj,"and, behold, the lord stood above it, and said, i am the lord god of abraham thy father, and the god of isaac: the land whereon thou liest, to thee will i give it, and to thy seed;","o jiova sa tu mai cake ka tukuna: ""oi au o jiova na kalou i eparaama, na kalou i aisake. na qele o davoca tiko oqori, au na solia vei iko kei ira na nomu kawa."
bible,genesis,bible|genesis|028|014,genesis,28,14,en,fj,en->fj,"and thy seed shall be as the dust of the earth, and thou shalt spread abroad to the west, and to the east, and to the north, and to the south: and in thee and in thy seed shall all the families of the earth be blessed.","""o ira talega na nomu kawa era na vaka na kuvu ni qele (kedra i wiliwili); o na tete vaka ki na ra, ki na tokalau, ki na vualiku ki na ceva talega. mai vei iko kei ira na nomu kawa, ena vakalouvinakataki kina o vuravura taucoko."
bible,genesis,bible|genesis|028|015,genesis,28,15,en,fj,en->fj,"and, behold, i am with thee, and will keep thee in all places whither thou goest, and will bring thee again into this land; for i will not leave thee, until i have done that which i have spoken to thee of.","""raica, au sa tiko vata kei iko, me'u maroroi iko ena vanua kecega o sa na lako kina ka au na kauti iko lesu tale mai ki na vanua oqo, au na sega ni laivi iko me yacova ni'u sa cakava kece na veika au sa vosa kina vei iko. """
bible,genesis,bible|genesis|028|016,genesis,28,16,en,fj,en->fj,"and jacob awaked out of his sleep, and he said, surely the lord is in this place; and i knew it not.","sa yadra vakasauri o jekope mai na nona moce ka tukuna, ""sa dina, o jiova sa tiko eke ka au sa sega tu ni kila. """
bible,genesis,bible|genesis|028|017,genesis,28,17,en,fj,en->fj,"and he was afraid, and said, how dreadful is this place! this is none other but the house of god, and this is the gate of heaven.","sa rerevaka levu ka tukuna, ""sa vanua vinaka dina oqo, sa sega tale ni dua na ka oqo â€œna vale ni kalou ga â€œoqo sara ga na matamata ki lomalagi! """
bible,genesis,bible|genesis|028|018,genesis,28,18,en,fj,en->fj,"and jacob rose up early in the morning, and took the stone that he had put for his pillows, and set it up for a pillar, and poured oil upon the top of it.","sa yadra vakamataka lailai o jekope, sa taura na vatu (nona i lokoloko) sa vakaduria me duru, ka sa lumuta ena waiwai."
bible,genesis,bible|genesis|028|019,genesis,28,19,en,fj,en->fj,and he called the name of that place bethel: but the name of that city was called luz at the first.,sa vakatoka na yaca ni vanua o ya me peceli; na yaca ni vanua o ya e liu o luse.
bible,genesis,bible|genesis|028|020,genesis,28,20,en,fj,en->fj,"and jacob vowed a vow, saying, if god will be with me, and will keep me in this way that i go, and will give me bread to eat, and raiment to put on,","sa yalayala (bubului) o jekope ka vaka: ""kevaka sa tiko vata kei au na kalou, ka maroroi au ena sala au sa lakova tiko oqo, ka solia vei au na kakana me'u kania kei nai sulu me'u suluma,"
bible,genesis,bible|genesis|028|021,genesis,28,21,en,fj,en->fj,so that i come again to my father's house in peace; then shall the lord be my god:,"""me'u lesu tale mai kina ki na vale nei tamaqu ena vakacegu â€œo jiova, sa na noqu kalou."
bible,genesis,bible|genesis|028|022,genesis,28,22,en,fj,en->fj,"and this stone, which i have set for a pillar, shall be god's house: and of all that thou shalt give me i will surely give the tenth unto thee.","""na vatu oqo au sa vakaduria me duru, sa na vale ni kalou. na veika kece o ni na solia vei au, na kena i katini (sigana) au na solia vakaidina vei kemuni. """
bible,genesis,bible|genesis|029|001,genesis,29,1,en,fj,en->fj,"then jacob went on his journey, and came into the land of the people of the east.",o jekope sa lako ena nona i lakolako ka sa yaco ki na nodra vanua na tamata mai na tokalau.
bible,genesis,bible|genesis|029|002,genesis,29,2,en,fj,en->fj,"and he looked, and behold a well in the field, and, lo, there were three flocks of sheep lying by it; for out of that well they watered the flocks: and a great stone was upon the well's mouth.",sa rai yani ka raica e dua na mata ni wai ena buca; era sa davo voleka tu kina e tolu na qele ni sipi. era sa dau gunu na sipi mai na mata ni wai oqori. e dua na vatu levu sa ubi tu kina na mata ni wai.
bible,genesis,bible|genesis|029|003,genesis,29,3,en,fj,en->fj,"and thither were all the flocks gathered: and they rolled the stone from the well's mouth, and watered the sheep, and put the stone again upon the well's mouth in his place.","era sa dau lako yani ki kea na qele ni manumanu, sa dau vakaqiqici tani na vatu mai na gusu ni mata ni wai, era sa dau gunu na sipi ka sogo tale na mata ni wai ena vatu."
bible,genesis,bible|genesis|029|004,genesis,29,4,en,fj,en->fj,"and jacob said unto them, my brethren, whence be ye? and they said, of haran are we.","sa taro yani vei ira o jekope, ""kemudou na taciqu, oi kemudou sara mada mai vei? "" e ratou sa sauma, ""mai arana. """
bible,genesis,bible|genesis|029|005,genesis,29,5,en,fj,en->fj,"and he said unto them, know ye laban the son of nahor? and they said, we know him.","sa qai taro tale vei iratou, ""dou sa kilai lepani beka, na luvei neori? "" e ratou sa sauma mai, ""keitou sa kilai koya. """
bible,genesis,bible|genesis|029|006,genesis,29,6,en,fj,en->fj,"and he said unto them, is he well? and they said, he is well: and, behold, rachel his daughter cometh with the sheep.","""sa vinaka tiko beka o koya se sega? "" e ratou sa sauma mai, ""io, sa bula vinaka o koya, raica o raijeli na luvena yalewa sa lako tiko mai oqori kei ira na sipi. """
bible,genesis,bible|genesis|029|007,genesis,29,7,en,fj,en->fj,"and he said, lo, it is yet high day, neither is it time that the cattle should be gathered together: water ye the sheep, and go and feed them.","sa tukuna sara o jekope, ""raica e se sigalevu tutu na vanua, e se sega ni kena gauna me ra kacivi vata mai na sipi. me ra gunu na sipi ka dou vakania talega. """
bible,genesis,bible|genesis|029|008,genesis,29,8,en,fj,en->fj,"and they said, we cannot, until all the flocks be gathered together, and till they roll the stone from the well's mouth; then we water the sheep.","e ratou sa tukuna mai, ""keitou na sega ni cakava oqori, vakavo ke sa soqoni vata kece mai na manumanu, ka vakaqiqici tani na vatu mai na gusu ni mata ni wai, era na qai gunu. """
bible,genesis,bible|genesis|029|009,genesis,29,9,en,fj,en->fj,"and while he yet spake with them, rachel came with her father's sheep: for she kept them.","ni se vosa tiko ga vei ira, sa lako mai o raijeli kei na sipi nei tamana â€œni sa dau qarava na vakatawani ni sipi."
bible,genesis,bible|genesis|029|010,genesis,29,10,en,fj,en->fj,"and it came to pass, when jacob saw rachel the daughter of laban his mother's brother, and the sheep of laban his mother's brother, that jacob went near, and rolled the stone from the well's mouth, and watered the flock of laban his mother's brother.","o jekope ni sa raici raijeli, na luvei lepani na ganei tinana, kei na sipi nei lepani, sa toso yani o jekope ka vakaqiqica tani na vatu mai na mata ni wai, ka vakagunuvi ira na sipi nei lepani."
bible,genesis,bible|genesis|029|011,genesis,29,11,en,fj,en->fj,"and jacob kissed rachel, and lifted up his voice, and wept.","o jekope sa reguci raijeli, ka sa tagi."
bible,genesis,bible|genesis|029|012,genesis,29,12,en,fj,en->fj,"and jacob told rachel that he was her father's brother, and that he was rebekah's son: and she ran and told her father.","o jekope sa tukuna vei raijeli ni o koya na wekai lepani, ka ni sa luvei rapeka. sa cici yani o raijeli ka tukuna vei tamana."
bible,genesis,bible|genesis|029|013,genesis,29,13,en,fj,en->fj,"and it came to pass, when laban heard the tidings of jacob his sister's son, that he ran to meet him, and embraced him, and kissed him, and brought him to his house. and he told laban all these things.","ni sa rogoca o lepani nai tukutuku kei jekope na luvei ganena, sa cici sara yani me sotavi koya. sa mokoti koya ka reguci koya ka kauti koya sara yani ki nona vale. sa tukuna o jekope na veika kece vei lepani."
bible,genesis,bible|genesis|029|014,genesis,29,14,en,fj,en->fj,"and laban said to him, surely thou art my bone and my flesh. and he abode with him the space of a month.","sa tukuna vua o lepani, ""e dina, e daru sa sui vata ka lewe vata. "" sa tiko e kea o jekope me vula dua."
bible,genesis,bible|genesis|029|015,genesis,29,15,en,fj,en->fj,"and laban said unto jacob, because thou art my brother, shouldest thou therefore serve me for nought? tell me, what shall thy wages be?","sa tukuna o lepani vei jekope, ""baleta ni o sa wekaqu, e dodonu beka mo cakacaka wale vei au? tukuna mada vei au, na cava me kemu i sau? """
bible,genesis,bible|genesis|029|016,genesis,29,16,en,fj,en->fj,"and laban had two daughters: the name of the elder was leah, and the name of the younger was rachel.",o lepani sa rua tiko na luvena yalewa: sa qase o lia ka gone o raijeli.
bible,genesis,bible|genesis|029|017,genesis,29,17,en,fj,en->fj,leah was tender eyed; but rachel was beautiful and well favoured.,"sa mata kamica o lia, ia, o raijeli sa rui totoka qai talei na kena i rairai."
bible,genesis,bible|genesis|029|018,genesis,29,18,en,fj,en->fj,"and jacob loved rachel; and said, i will serve thee seven years for rachel thy younger daughter.","o jekope e taleitaki raijeli vakalevu ka tukuna, ""au na qaravi iko me vitu na yabaki ena vuku i raijeli na luvemu yalewa gone. """
bible,genesis,bible|genesis|029|019,genesis,29,19,en,fj,en->fj,"and laban said, it is better that i give her to thee, than that i should give her to another man: abide with me.","sa sauma o lepani, ""e vinaka me'u solia na luvequ vei iko â€œka sega ni vua tale e dua na tagane. mo tiko mada vata kei au. """
bible,genesis,bible|genesis|029|020,genesis,29,20,en,fj,en->fj,"and jacob served seven years for rachel; and they seemed unto him but a few days, for the love he had to her.","sa cakacakataka na vitu na yabaki o jekope ena vuku i raijeli â€œsa vaka ga e vica na siga na vitu na yabaki oqori, baleta ni sa rui vinakati raijeli vakalevu."
bible,genesis,bible|genesis|029|021,genesis,29,21,en,fj,en->fj,"and jacob said unto laban, give me my wife, for my days are fulfilled, that i may go in unto her.","o jekope sa tukuna vei lepani, ""solia vei au na watiqu, ni sa oti na noqu veisiga ni veiqaravi, ni'u sa vinakata me curumi koya. """
bible,genesis,bible|genesis|029|022,genesis,29,22,en,fj,en->fj,"and laban gathered together all the men of the place, and made a feast.","sa kacivi ira kece mai na tamata o lepani, ka cakava e dua na kakana levu."
bible,genesis,bible|genesis|029|023,genesis,29,23,en,fj,en->fj,"and it came to pass in the evening, that he took leah his daughter, and brought her to him; and he went in unto her.","ni sa yakavi bogi mai, sa tauri lia ka kauti koya mai vei jekope. sa curumi koya sara o jekope."
bible,genesis,bible|genesis|029|024,genesis,29,24,en,fj,en->fj,and laban gave unto his daughter leah zilpah his maid for an handmaid.,o lepani sa soli siliva na nona dauveiqaravi me dauveiqaravi nei lia.
bible,genesis,bible|genesis|029|025,genesis,29,25,en,fj,en->fj,"and it came to pass, that in the morning, behold, it was leah: and he said to laban, what is this thou hast done unto me? did not i serve with thee for rachel? wherefore then hast thou beguiled me?","ni sa mataka mai, sa kila o jekope ni sa i lia ka sega ni o raijeli. sa tarogi lepani sara, ""na cava o sa cakava vei au? e sega beka ni au a cakacaka ena vuku i raijeli? na cava o sa vakaisini au kina? """
bible,genesis,bible|genesis|029|026,genesis,29,26,en,fj,en->fj,"and laban said, it must not be so done in our country, to give the younger before the firstborn.","sa sauma o lepani, ""e sega ni dodonu me caka oqo, ena neimami vanua â€œme dau soli e liu na gone mai vua na qase."
bible,genesis,bible|genesis|029|027,genesis,29,27,en,fj,en->fj,"fulfil her week, and we will give thee this also for the service which thou shalt serve with me yet seven other years.","""mo cakacakataka talega na nona gauna, me qai soli kina vei iko. """
bible,genesis,bible|genesis|029|028,genesis,29,28,en,fj,en->fj,"and jacob did so, and fulfilled her week: and he gave him rachel his daughter to wife also.","sa qai cakacakataka o jekope na vitu tale na yabaki, sa qai soli vei koya o raijeli me watina."
bible,genesis,bible|genesis|029|029,genesis,29,29,en,fj,en->fj,and laban gave to rachel his daughter bilhah his handmaid to be her maid.,"o lepani sa soli bila na nona dauveiqaravi, me dauveiqaravi nei raijeli."
bible,genesis,bible|genesis|029|030,genesis,29,30,en,fj,en->fj,"and he went in also unto rachel, and he loved also rachel more than leah, and served with him yet seven other years.","sa curumi raijeli o jekope ni sa taleitaki koya vakalevu, ni sa qaravi lepani ena vitu tale na yabaki."
bible,genesis,bible|genesis|029|031,genesis,29,31,en,fj,en->fj,"and when the lord saw that leah was hated, he opened her womb: but rachel was barren.","ni sa raica o jiova ni sega ni lomani vakalevu o lia â€œna kalou sa qai dolava na kato ni gone nei lia, qai sogota na kato nei raijeli."
bible,genesis,bible|genesis|029|032,genesis,29,32,en,fj,en->fj,"and leah conceived, and bare a son, and she called his name reuben: for she said, surely the lord hath looked upon my affliction; now therefore my husband will love me.","sa kunekune o lia ka vakasucuma e dua na tagane, ka vakayacani koya me o rupeni; ni sa tukuna, ""o jiova sa raica dina na noqu rarawa. oqo ena lomani au kina o na watiqu jekope. """
bible,genesis,bible|genesis|029|033,genesis,29,33,en,fj,en->fj,"and she conceived again, and bare a son; and said, because the lord hath heard that i was hated, he hath therefore given me this son also: and she called his name simeon.","sa kunekune tale ka vakasucuma e dua na tagane ka tukuna, ""o jiova sa rogoca ni'u sa sega ni lomani. oqo sa solia kina vei au e dua tale na tagane. "" sa yacana o simione."
bible,genesis,bible|genesis|029|034,genesis,29,34,en,fj,en->fj,"and she conceived again, and bare a son; and said, now this time will my husband be joined unto me, because i have born him three sons: therefore was his name called levi.","sa kunekune ka vakasucuma tale e dua na tagane, sa tukuna kina, ""oqo sa na qai kabiti au kina o watiqu (jekope), baleta ni'u sa vakasucuma vua e tolu na gone tagane. "" sa yacana o livai."
bible,genesis,bible|genesis|029|035,genesis,29,35,en,fj,en->fj,"and she conceived again, and bare a son: and she said, now will i praise the lord: therefore she called his name judah; and left bearing.","sa kunekune tale ka vakasucuma e dua tale na tagane, sa tukuna kina, ""oqo au na vakavinavinaka vua na kalou. "" sa vakayacana kina na gone me o juta. sa qai tu vakadua na nona vakasucu gone."
bible,genesis,bible|genesis|030|001,genesis,30,1,en,fj,en->fj,"and when rachel saw that she bare jacob no children, rachel envied her sister; and said unto jacob, give me children, or else i die.","ni sa raica o raijeli ni sa sega tiko ni vakaluveni vei jekope, sa vuvutaki tuakana vakalevu, sa tukuna vei jekope, ""solia vei au e dua na gone, de'u na qai mate! """
bible,genesis,bible|genesis|030|002,genesis,30,2,en,fj,en->fj,"and jacob's anger was kindled against rachel: and he said, am i in god's stead, who hath withheld from thee the fruit of the womb?","sa cudru vakalevu o jekope ena vuku i raijeli, sa tukuna kina, ""o au beka na kalou ni o koya ga e lewa na vakaluveni, ni o koya ga e sogota tiko na nomu bola ni gone? """
bible,genesis,bible|genesis|030|003,genesis,30,3,en,fj,en->fj,"and she said, behold my maid bilhah, go in unto her; and she shall bear upon my knees, that i may also have children by her.","sa tukuna mai o raijeli, ""oqo o bila na noqu dauveiqaravi, vakacurumi iko vua me vakasucuma kina e dua na gone e duruqu, me dua kina na luvequ mai vua. """
bible,genesis,bible|genesis|030|004,genesis,30,4,en,fj,en->fj,and she gave him bilhah her handmaid to wife: and jacob went in unto her.,"sa soli bila vua, ka sa curumi koya sara o jekope."
bible,genesis,bible|genesis|030|005,genesis,30,5,en,fj,en->fj,"and bilhah conceived, and bare jacob a son.","sa kunekune o bila, ka vakasucuma vei jekope e dua na tagane."
bible,genesis,bible|genesis|030|006,genesis,30,6,en,fj,en->fj,"and rachel said, god hath judged me, and hath also heard my voice, and hath given me a son: therefore called she his name dan.","sa tukuna o raijeli, ""sa vakatulewa vei au na kalou; sa rogoca talega o koya na domoqu ka solia vei au e dua na gone. "" sa vakayacani koya kina me o tani."
bible,genesis,bible|genesis|030|007,genesis,30,7,en,fj,en->fj,"and bilhah rachel's maid conceived again, and bare jacob a second son.","sa kunekune tale na dauveiqaravi nei raijeli, o bila, sa vakasucuma vei jekope nai karua ni luvena."
bible,genesis,bible|genesis|030|008,genesis,30,8,en,fj,en->fj,"and rachel said, with great wrestlings have i wrestled with my sister, and i have prevailed: and she called his name naphtali.","sa tukuna o raijeli, ""au sa veiqati vakalevu kei na tuakaqu ia, au sa toso tikoga. "" sa vakayacana na gone me o navitalai."
bible,genesis,bible|genesis|030|009,genesis,30,9,en,fj,en->fj,"when leah saw that she had left bearing, she took zilpah her maid, and gave her jacob to wife.","o lia, ni sa sega tiko ni dua tale na luvena, sa tauri siliva na nona dauveiqaravi ka solia vei jekope me curumi koya."
bible,genesis,bible|genesis|030|010,genesis,30,10,en,fj,en->fj,and zilpah leah's maid bare jacob a son.,o siliva sa vakasucuma vei jekope e dua na tagane.
bible,genesis,bible|genesis|030|011,genesis,30,11,en,fj,en->fj,"and leah said, a troop cometh: and she called his name gad.","sa tukuna o lia, ""sa lako tiko mai na mataivalu. "" sa vakayacana me o kata."
bible,genesis,bible|genesis|030|012,genesis,30,12,en,fj,en->fj,and zilpah leah's maid bare jacob a second son.,o siliva sa vakasucuma nai karua ni luvei jekope.
bible,genesis,bible|genesis|030|013,genesis,30,13,en,fj,en->fj,"and leah said, happy am i, for the daughters will call me blessed: and she called his name asher.","sa tukuna o lia, ""au sa marau, ni ra na tukuna vei au na goneyalewa na dauveivakalouvinakataki. "" sa vakayacani koya kina me o aseri."
bible,genesis,bible|genesis|030|014,genesis,30,14,en,fj,en->fj,"and reuben went in the days of wheat harvest, and found mandrakes in the field, and brought them unto his mother leah. then rachel said to leah, give me, i pray thee, of thy son's mandrakes.","o rupeni sa lako yani ena gauna ni tatamusuki, ka sa kunea mai e so na wainimate ni moce, ka sa kauta sara mai vei tinana. sa kerekere yani o raijeli vei lia ka vaka: ""au kerea e so na wai ni moce nei rupeni. """
bible,genesis,bible|genesis|030|015,genesis,30,15,en,fj,en->fj,"and she said unto her, is it a small matter that thou hast taken my husband? and wouldest thou take away my son's mandrakes also? and rachel said, therefore he shall lie with thee to night for thy son's mandrakes.","sa sauma mai o lia, ""e se lailai vei iko o jekope na watiqu? oqo, o sa vinakata tale na wai ni moce nei luvequ talega? "" sa sauma yani o raijeli, ""drau moce vata mada ena bogi oqo, mei sosomi ni wai ni moce oqori. """
bible,genesis,bible|genesis|030|016,genesis,30,16,en,fj,en->fj,"and jacob came out of the field in the evening, and leah went out to meet him, and said, thou must come in unto me; for surely i have hired thee with my son's mandrakes. and he lay with her that night.","ni sa lesu mai o jekope mai na veiwere ena yakavi, sa lako yani o lisa ka tukuna vua, ""mo mai curu vei au, ni sa o saumi oti ena wai ni moce nei luvequ. "" e rau sa mai veimoceri ena bogi o ya."
bible,genesis,bible|genesis|030|017,genesis,30,17,en,fj,en->fj,"and god hearkened unto leah, and she conceived, and bare jacob the fifth son.","na kalou sa rogoci lia, sa kunekune ka vakasucuma vei jekope nai ka lima ni luvena tagane."
bible,genesis,bible|genesis|030|018,genesis,30,18,en,fj,en->fj,"and leah said, god hath given me my hire, because i have given my maiden to my husband: and she called his name issachar.","sa tukuna kina o lia, ""na kalou sa solia vei au na kequ i voli, ni'u sa solia na noqu dauveiqaravi vei watiqu. "" sa vakayacani koya kina me o isakari."
bible,genesis,bible|genesis|030|019,genesis,30,19,en,fj,en->fj,"and leah conceived again, and bare jacob the sixth son.","sa kunekune tale o lia, ka sa vakasucuma nai ka ono ni luvena vei jekope."
bible,genesis,bible|genesis|030|020,genesis,30,20,en,fj,en->fj,"and leah said, god hath endued me with a good dowry; now will my husband dwell with me, because i have born him six sons: and she called his name zebulun.","sa tukuna o lia, ""na kalou sa vakatikora vei au na veika vivinaka, oqo sa na tikoga kina vata kei au o na watiqu, baleta ni'u sa vakasucuma vua e ono na luvena tagane. "" sa vakayacani koya kina me o sevuloni."
bible,genesis,bible|genesis|030|021,genesis,30,21,en,fj,en->fj,"and afterwards she bare a daughter, and called her name dinah.","sa qai vakasucuma tale e dua na luvena yalewa, ka vakayacani koya me o taina."
bible,genesis,bible|genesis|030|022,genesis,30,22,en,fj,en->fj,"and god remembered rachel, and god hearkened to her, and opened her womb.","na kalou sa qai nanumi raijeli, sa rogoci koya ka dolava na nona kato ni gone."
bible,genesis,bible|genesis|030|023,genesis,30,23,en,fj,en->fj,"and she conceived, and bare a son; and said, god hath taken away my reproach:","sa kunekune ka vakasucuma e dua na tagane, ka tukuna, ""na kalou sa kauta tani na noqu rogorogo ca. """
bible,genesis,bible|genesis|030|024,genesis,30,24,en,fj,en->fj,"and she called his name joseph; and said, the lord shall add to me another son.","sa vakayacani koya me o joseva ka tukuna kina, ""o jiova ena solia tale vei au e dua na luvequ tagane. """
bible,genesis,bible|genesis|030|025,genesis,30,25,en,fj,en->fj,"and it came to pass, when rachel had born joseph, that jacob said unto laban, send me away, that i may go unto mine own place, and to my country.","ni sa vakasucumi joseva oti o raijeli, sa tukuna o jekope vei lepani, ""laivi au me'u lako, me'u lako ki na noqu tikina, ki na noqu vanua."
bible,genesis,bible|genesis|030|026,genesis,30,26,en,fj,en->fj,"give me my wives and my children, for whom i have served thee, and let me go: for thou knowest my service which i have done thee.","""soli ira vei au na watiqu, kei ira na luvequ, o ira, au sa qaravi iko kina, ka laivi keimami me keimami lako, o sa kila talega na veiqaravi au sa cakava vei iko. """
bible,genesis,bible|genesis|030|027,genesis,30,27,en,fj,en->fj,"and laban said unto him, i pray thee, if i have found favour in thine eyes, tarry: for i have learned by experience that the lord hath blessed me for thy sake.","sa tukuna vua o lepani, ""mo tiko mada, kevaka au sa kune loloma e matamu, ni'u sa kila ka vulica ni o jiova sa vakalouvinakataki au ena vukumu. """
bible,genesis,bible|genesis|030|028,genesis,30,28,en,fj,en->fj,"and he said, appoint me thy wages, and i will give it.","sa qai tukuna tale yani, ""tukuna vei au na kemu i sau, au na solia vei iko. """
bible,genesis,bible|genesis|030|029,genesis,30,29,en,fj,en->fj,"and he said unto him, thou knowest how i have served thee, and how thy cattle was with me.","sa tukuna vua o jekope, ""o sa kila vinaka na noqu qaravi iko kei na qaravi ni nomu manumanu."
bible,genesis,bible|genesis|030|030,genesis,30,30,en,fj,en->fj,"for it was little which thou hadst before i came, and it is now increased unto a multitude; and the lord hath blessed thee since my coming: and now when shall i provide for mine own house also?","""na veika e a tu vei iko e liu ni se bera na noqu lako mai, e lailai oqo sa levu sara; na kalou sa vakalouvinakataki iko mai na gauna au a lako mai kina. oqo au na vakania talega na noqu vale ena gauna cava? """
bible,genesis,bible|genesis|030|031,genesis,30,31,en,fj,en->fj,"and he said, what shall i give thee? and jacob said, thou shalt not give me any thing: if thou wilt do this thing for me, i will again feed and keep thy flock.","sa tukuna mai o lepani, ""na cava me'u solia vei iko? "" sa sauma mai o jekope, ""kua ni solia vei au e dua na ka, au na tiko tale me'u veiqaravi, kevaka o solia vei au na ka:"
bible,genesis,bible|genesis|030|032,genesis,30,32,en,fj,en->fj,"i will pass through all thy flock to day, removing from thence all the speckled and spotted cattle, and all the brown cattle among the sheep, and the spotted and speckled among the goats: and of such shall be my hire.","""me'u lako mada yani ki na qele ni manumanu ena siga oqo, na manumanu kece sa tavutonotono me wasei mai na kena e dravu. na sipi, na lami, na me, oqori me kequ i sau."
bible,genesis,bible|genesis|030|033,genesis,30,33,en,fj,en->fj,"so shall my righteousness answer for me in time to come, when it shall come for my hire before thy face: every one that is not speckled and spotted among the goats, and brown among the sheep, that shall be counted stolen with me.","""ena saumi vei au na noqu yalododonu na veisiga ni mataka, ni sa lako mai vei iko na kequ i sau. na manumanu kece sa sega ni tavutonotono ena kedra maliwa na me, ka dravu vei ira na lami, era na kilai me sa ka butakoci, kevaka era sa kune vei au. """
bible,genesis,bible|genesis|030|034,genesis,30,34,en,fj,en->fj,"and laban said, behold, i would it might be according to thy word.","sa tukuna o lepani, ""io, oqori sa na vaka na nomu vosa! """
