domain,subdomain,source_id,book,chapter,verse,source_lang,target_lang,direction,source_text,target_text
bible,genesis,bible|genesis|001|001,genesis,1,1,en,fj,en->fj,in the beginning god created the heaven and the earth.,"na kalou, e nai tekitekivu ni ka kecega, sa vakavuna na veilomalagi kei na vuravura."
bible,genesis,bible|genesis|001|002,genesis,1,2,en,fj,en->fj,"and the earth was without form, and void; and darkness was upon the face of the deep. and the spirit of god moved upon the face of the waters.","na vuravura sa sega ni vakavotukana tu, qai lala talega; na kena butobuto sa titobu sara. na yalo ni kalou sa vakaraica sobu tu mai na dela ni wai."
bible,genesis,bible|genesis|001|003,genesis,1,3,en,fj,en->fj,"and god said, let there be light: and there was light.","na kalou sa tukuna, ""me sa rarama mai, "" sa qai dua sara na rarama."
bible,genesis,bible|genesis|001|004,genesis,1,4,en,fj,en->fj,"and god saw the light, that it was good: and god divided the light from the darkness.","na kalou sa raica na rarama, ka sa vinaka. na kalou sa wasea na rarama mai na butobuto."
bible,genesis,bible|genesis|001|005,genesis,1,5,en,fj,en->fj,"and god called the light day, and the darkness he called night. and the evening and the morning were the first day.","na kalou sa tukuna, na rarama me siga, kei na butobuto me bogi. na karobo ni yakavi ki na kida ni mataka, sai matai ni siga."
bible,genesis,bible|genesis|001|006,genesis,1,6,en,fj,en->fj,"and god said, let there be a firmament in the midst of the waters, and let it divide the waters from the waters.","na kalou sa tukuna, ""me dua mada na kabukabu, me wasea na veiwai mai na veiwai. """
bible,genesis,bible|genesis|001|007,genesis,1,7,en,fj,en->fj,"and god made the firmament, and divided the waters which were under the firmament from the waters which were above the firmament: and it was so.","na kalou sa qai cakava na kabukabu, ka sa wasea na wai sa tiko ena ruku ni kabukabu kei na wai ena dela ni kabukabu, sa yaco me vakakina."
bible,genesis,bible|genesis|001|008,genesis,1,8,en,fj,en->fj,and god called the firmament heaven. and the evening and the morning were the second day.,"na kalou sa vakayacana na kabukabu ni maliwa lala, na lomalagi, sa karobo na yakavi ka sa mataka tale, sai karua ni siga."
bible,genesis,bible|genesis|001|009,genesis,1,9,en,fj,en->fj,"and god said, let the waters under the heaven be gathered together unto one place, and let the dry land appear: and it was so.","na kalou sa tukuna, ""na wai kece ena ruku i lomalagi, me vakasoqoni kece ena dua na vanua, ka me basika mai na vanua mamaca; "" sa yaco me vakakina."
bible,genesis,bible|genesis|001|010,genesis,1,10,en,fj,en->fj,and god called the dry land earth; and the gathering together of the waters called he seas: and god saw that it was good.,"na kalou sa vakayacana na vanua mamaca me vuravura, kei na wai sa vakasoqoni vata tu, me, wasawasa. na kalou sa raica oqo ni sa vinaka."
bible,genesis,bible|genesis|001|011,genesis,1,11,en,fj,en->fj,"and god said, let the earth bring forth grass, the herb yielding seed, and the fruit tree yielding fruit after his kind, whose seed is in itself, upon the earth: and it was so.","na kalou sa qai tukuna, ""na vanua me vakatubura mai na veico, na veisenikau kei na botebotekoro sa vakasorena, na veivunikau sa vakavuana ena kena veimataqali sa tiko e loma na sorena, "" sa yaco me vakakina."
bible,genesis,bible|genesis|001|012,genesis,1,12,en,fj,en->fj,"and the earth brought forth grass, and herb yielding seed after his kind, and the tree yielding fruit, whose seed was in itself, after his kind: and god saw that it was good.","sa tubu mai na veico, na veisenikau, na botebotekoro vakasorena na kena veimataqali, na veivunikau vakavuana sa tiko e loma na sorena ena kena veimataqali. na kalou sa raica ni sa vinaka."
bible,genesis,bible|genesis|001|013,genesis,1,13,en,fj,en->fj,and the evening and the morning were the third day.,"sa karobo, ka sa mataka tale na i katolu ni siga."
bible,genesis,bible|genesis|001|014,genesis,1,14,en,fj,en->fj,"and god said, let there be lights in the firmament of the heaven to divide the day from the night; and let them be for signs, and for seasons, and for days, and years:","na kalou sa tukuna tale, ""me dua na rarama me tiko mai lomalagi, me wasea na siga mai na bogi, me vakatakilakila ni veiveisau ni veitabadraki kei na veitaba-gauna, vakasiga ka vakayabaki talega;"
bible,genesis,bible|genesis|001|015,genesis,1,15,en,fj,en->fj,and let them be for lights in the firmament of the heaven to give light upon the earth: and it was so.,"""me rarama kina na veilomalagi ka me solia mai na rarama e vuravura. "" sa yaco me vakakina."
bible,genesis,bible|genesis|001|016,genesis,1,16,en,fj,en->fj,"and god made two great lights; the greater light to rule the day, and the lesser light to rule the night: he made the stars also.","na kalou sa cakava e rua na rarama levu, na rarama levu me lewa na siga kei na rarama me lewa na bogi. sa bulia talega na veikalokalo."
bible,genesis,bible|genesis|001|017,genesis,1,17,en,fj,en->fj,"and god set them in the firmament of the heaven to give light upon the earth,","na kalou sa vakatikori ira na veirarama oqo ena veiyasana vakalomalagi, me ra solia mai na rarama ki vuravura,"
bible,genesis,bible|genesis|001|018,genesis,1,18,en,fj,en->fj,"and to rule over the day and over the night, and to divide the light from the darkness: and god saw that it was good.","ka me ra lewa talega na siga kei na bogi, me ra wasea na rarama mai na butobuto. na kalou, ni sa raica oqo, sa vinaka vua."
bible,genesis,bible|genesis|001|019,genesis,1,19,en,fj,en->fj,and the evening and the morning were the fourth day.,"oqo na karobo ni yakavi kei na mataka, sa i ka va ni siga."
bible,genesis,bible|genesis|001|020,genesis,1,20,en,fj,en->fj,"and god said, let the waters bring forth abundantly the moving creature that hath life, and fowl that may fly above the earth in the open firmament of heaven.","na kalou sa qai tukuna, ""me sa levu mai na wai, ka me levu talega mai na vei manumanu bula, me ra sa vuka mai na manumanu vuka e delai vuravura ka vukaca yani na veiyasana vakalomalagi. """
bible,genesis,bible|genesis|001|021,genesis,1,21,en,fj,en->fj,"and god created great whales, and every living creature that moveth, which the waters brought forth abundantly, after their kind, and every winged fowl after his kind: and god saw that it was good.","na kalou sa qai bulia na veimanumanu levu ni waitui kei na veika bula kecega era sinai tu mai na wailevu ena kena veimataqali, na vei manumanu kece vakatabana ena kena veimataqali. na kalou, ni sa raica oqo sa vinaka vua."
bible,genesis,bible|genesis|001|022,genesis,1,22,en,fj,en->fj,"and god blessed them, saying, be fruitful, and multiply, and fill the waters in the seas, and let fowl multiply in the earth.","na kalou sa qai vosa vakalouvinakataka na veika oqo ka tukuna, ""mo ni yagavakalevu ka vakavuqataki kemuni ka vakatawana na wai ni wasawasa kei na manumanu vuka me levu sara e vuravura. """
bible,genesis,bible|genesis|001|023,genesis,1,23,en,fj,en->fj,and the evening and the morning were the fifth day.,sa qai karobo na yakavi ka mataka tale ni kalima ni siga.
bible,genesis,bible|genesis|001|024,genesis,1,24,en,fj,en->fj,"and god said, let the earth bring forth the living creature after his kind, cattle, and creeping thing, and beast of the earth after his kind: and it was so.","na kalou sa qai tukuna, ""o vuravura me kauta mai na veika bula me vaka na kena veimataqali na manumanu yavai va, na veimanumanu kece sa qasi voli, na veimanumanu kila ni veikau, o ira kece oqo kei na kena veimataqali, "" sa yaco me vakakina."
bible,genesis,bible|genesis|001|025,genesis,1,25,en,fj,en->fj,"and god made the beast of the earth after his kind, and cattle after their kind, and every thing that creepeth upon the earth after his kind: and god saw that it was good.","na kalou sa bulia na veimanumanu ni vuravura me vaka na kena veimataqali, na bulumakau, na veika sa qasi voli, na veimanumanu kila ni vanua, me vaka na kedra dui veimataqali. na kalou ni sa raica oqo, sa vinaka dina."
bible,genesis,bible|genesis|001|026,genesis,1,26,en,fj,en->fj,"and god said, let us make man in our image, after our likeness: and let them have dominion over the fish of the sea, and over the fowl of the air, and over the cattle, and over all the earth, and over every creeping thing that creepeth upon the earth.","na kalou sa tukuna, ""medatou bulia mada na tamata me vakataki kedatou, me rairai vakataki kedatou, me ra lewa na vei ika kecega mai wai, na veimanumanu vuka e macawa kei na manumanu kecega ni vanua kei na veika kecega sa qasi voli e delai vuravura. """
bible,genesis,bible|genesis|001|027,genesis,1,27,en,fj,en->fj,"so god created man in his own image, in the image of god created he him; male and female created he them.","na kalou, sa qai bulia na tamata me vakataki koya ga, e nai rairai ga e va-kalou, na kalou sa bulia kina na tamata, na tagane kei na yalewa sa bulia o koya."
bible,genesis,bible|genesis|001|028,genesis,1,28,en,fj,en->fj,"and god blessed them, and god said unto them, be fruitful, and multiply, and replenish the earth, and subdue it: and have dominion over the fish of the sea, and over the fowl of the air, and over every living thing that moveth upon the earth.","na kalou sa vakalouvinakataki rau, ka sa tukuna vei rau, ""mo drau yagavakalevu ka vakalewelevutaki kemudrau, me vakatawai o vuravura ka me vakarorogo vei kemudrau; drau lewa na ika mai wai, na manumanu vuka e macawa, kei na veika kecega sa lako voli e delai vuravura. """
bible,genesis,bible|genesis|001|029,genesis,1,29,en,fj,en->fj,"and god said, behold, i have given you every herb bearing seed, which is upon the face of all the earth, and every tree, in the which is the fruit of a tree yielding seed; to you it shall be for meat.","na kalou sa tukuna, ""raica, au sa solia vei kemudrau na veico kei na veika sa tubu mai ena qele, ka vakasorena tiko kei na vei vunikau vakavuana sa tiko e loma na sorena, oqori me kakana."
bible,genesis,bible|genesis|001|030,genesis,1,30,en,fj,en->fj,"and to every beast of the earth, and to every fowl of the air, and to every thing that creepeth upon the earth, wherein there is life, i have given every green herb for meat: and it was so.","""na vei manumanu kece ni veikau kei na manumanu vuka ni macawa kei na veika kecega sa qasi voli e vuravura ka bula tiko, au sa solia vei ira na co kei na botebotekoro kecega sa tubu mai me kedra kakana; "" sa yaco me vakakina."
bible,genesis,bible|genesis|001|031,genesis,1,31,en,fj,en->fj,"and god saw every thing that he had made, and, behold, it was very good. and the evening and the morning were the sixth day.","na kalou, ni sa raica na veika kece sa cakava oti, io, sa dina, sa vinaka sara. sa qai karobo na yakavi ka mataka ni ka ono ni siga."
bible,genesis,bible|genesis|002|001,genesis,2,1,en,fj,en->fj,"thus the heavens and the earth were finished, and all the host of them.","na veilomalagi kei na vuravura, kei na ka kecega sa tiko kina, sa buli oti."
bible,genesis,bible|genesis|002|002,genesis,2,2,en,fj,en->fj,and on the seventh day god ended his work which he had made; and he rested on the seventh day from all his work which he had made.,"ena i kavitu ni siga, sa mai oti kina na nona cakacaka na kalou. sa vakacegu ena i kavitu ni siga na kalou mai na nona cakacaka kecega ni veibuli sa cakava oti."
bible,genesis,bible|genesis|002|003,genesis,2,3,en,fj,en->fj,"and god blessed the seventh day, and sanctified it: because that in it he had rested from all his work which god created and made.","na kalou sa qai vakalouvinakataka nai kavitu ni siga ka vakatabuya, baleta ni sa vakacegu mai na nona cakacaka kecega sa cakava ka bulia na kalou."
bible,genesis,bible|genesis|002|004,genesis,2,4,en,fj,en->fj,"these are the generations of the heavens and of the earth when they were created, in the day that the lord god made the earth and the heavens,","oqo nai tukutuku ni veigauna kei lomalagi kei vuravura, ena gauna rau sa buli kina, ena siga sa bulia kina na lomalagi kei na vuravura na kalou o jiova,"
bible,genesis,bible|genesis|002|005,genesis,2,5,en,fj,en->fj,"and every plant of the field before it was in the earth, and every herb of the field before it grew: for the lord god had not caused it to rain upon the earth, and there was not a man to till the ground.","ni se bera ni tubu mai e dua na kau ena vanua se, e dua na co me tubu mai. na kalou o jiova e se bera ni vakavuna me tau mai na uca ki vuravura, ka e se bera ni tiko e dua na tamata me vakarautaka na qele;"
bible,genesis,bible|genesis|002|006,genesis,2,6,en,fj,en->fj,"but there went up a mist from the earth, and watered the whole face of the ground.",sa lako cake ga mai na tegu mai vuravura ka vakasuasuataka na qele taucoko.
bible,genesis,bible|genesis|002|007,genesis,2,7,en,fj,en->fj,"and the lord god formed man of the dust of the ground, and breathed into his nostrils the breath of life; and man became a living soul.",na kalou o jiova sa bulia na tamata mai na kuvu ni soso mai na qele ka solia nai cegu ni bula ki na ucuna; sa qai yaco me dua na ka bula na tamata.
bible,genesis,bible|genesis|002|008,genesis,2,8,en,fj,en->fj,and the lord god planted a garden eastward in eden; and there he put the man whom he had formed.,"na kalou o jiova sa tea e dua nai teitei ena tokalau kei iteni, sa qai vakatikora e kea na tamata sa bulia oti."
bible,genesis,bible|genesis|002|009,genesis,2,9,en,fj,en->fj,"and out of the ground made the lord god to grow every tree that is pleasant to the sight, and good for food; the tree of life also in the midst of the garden, and the tree of knowledge of good and evil.","mai na qele, na kalou o jiova sa vakatubura mai kina na kau kecega sa vinaka ni laurai, ka sa vinaka talega ni laukana. na vunikau ni bula sa tiko talega ena loma ni teitei kei na vunikau talega sa kilai kina na vinaka kei na ca."
bible,genesis,bible|genesis|002|010,genesis,2,10,en,fj,en->fj,"and a river went out of eden to water the garden; and from thence it was parted, and became into four heads.",e dua na uciwai sa drodro mai iteni me vakasuasuataka na i teitei. mai iteni ga sa wase va mai kina na uciwai oqo.
bible,genesis,bible|genesis|002|011,genesis,2,11,en,fj,en->fj,"the name of the first is pison: that is it which compasseth the whole land of havilah, where there is gold;","nai matai ni uciwai o pisoni, sa drodro yani ena vanua taucoko o avila, na vanua sa tiko kina na koula."
bible,genesis,bible|genesis|002|012,genesis,2,12,en,fj,en->fj,and the gold of that land is good: there is bdellium and the onyx stone.,"na koula ni vanua oqo sa rui vinaka. na vatu talei, na onikisa sa tu e kea."
bible,genesis,bible|genesis|002|013,genesis,2,13,en,fj,en->fj,and the name of the second river is gihon: the same is it that compasseth the whole land of ethiopia.,na yaca ni karua ni uciwai o kioni; oqo e curuma yani na vanua taucoko o kusi.
bible,genesis,bible|genesis|002|014,genesis,2,14,en,fj,en->fj,and the name of the third river is hiddekel: that is it which goeth toward the east of assyria. and the fourth river is euphrates.,"nai katolu ni uciwai o itekeli, na uciwai oqo sa lako yani vaka ki asiria. na i ka va ni uciwai na uferetisi."
bible,genesis,bible|genesis|002|015,genesis,2,15,en,fj,en->fj,"and the lord god took the man, and put him into the garden of eden to dress it and to keep it.",na kalou o jiova sa kauta na tamata ka biuti koya ena i teitei mai iteni me qarava ka maroroya.
bible,genesis,bible|genesis|002|016,genesis,2,16,en,fj,en->fj,"and the lord god commanded the man, saying, of every tree of the garden thou mayest freely eat:","na kalou o jiova sa vakarota na tamata ka vaka: ""na veika kece sa tiko ena i teitei oqo mo kana mai kina;"
bible,genesis,bible|genesis|002|017,genesis,2,17,en,fj,en->fj,"but of the tree of the knowledge of good and evil, thou shalt not eat of it: for in the day that thou eatest thereof thou shalt surely die.","""ia na vunikau ga ni kila na ka vinaka kei na ka ca, mo kua ni kania, na siga o na kania kina na vuana, o na mate dina. """
bible,genesis,bible|genesis|002|018,genesis,2,18,en,fj,en->fj,"and the lord god said, it is not good that the man should be alone; i will make him an help meet for him.","na kalou o jiova sa tukuna, ""sa sega ni vinaka vua na tamata me tiko duadua. au na cakava e dua na nonai i vukevuke me vakatautauvatataki kei koya. """
bible,genesis,bible|genesis|002|019,genesis,2,19,en,fj,en->fj,"and out of the ground the lord god formed every beast of the field, and every fowl of the air; and brought them unto adam to see what he would call them: and whatsoever adam called every living creature, that was the name thereof.","na kalou o jiova sa bulia mai na qele na manumanu kecega ni vanua kei na manumanu vuka ni macawa ka kauta mai vei atama me raica se ena kacivi ira vakacava. na yaca ga sa kacivi ira kina o atama, sa yacadra sara ga."
bible,genesis,bible|genesis|002|020,genesis,2,20,en,fj,en->fj,"and adam gave names to all cattle, and to the fowl of the air, and to every beast of the field; but for adam there was not found an help meet for him.","o atama sa vakayacani ira kece na manumanu yavai va kei na manumanu vuka kecega kei na manumanu kecega ni vanua. ia me baleti atama, sa sega ni kune e dua me tautauvata kei koya me rawa ni dau veivuke vua."
bible,genesis,bible|genesis|002|021,genesis,2,21,en,fj,en->fj,"and the lord god caused a deep sleep to fall upon adam, and he slept: and he took one of his ribs, and closed up the flesh instead thereof;",na kalou o jiova sa vakavuna e dua na moce bi vei atama ka sa moce lutu sara kina. na kalou sa taura mai e dua na sui ni sarisarina ka ubia vinaka tale na lewena.
bible,genesis,bible|genesis|002|022,genesis,2,22,en,fj,en->fj,"and the rib, which the lord god had taken from man, made he a woman, and brought her unto the man.","na kalou o jiova sa vakayagataka na sui nei atama me bulia kina na yalewa, ka sa kauta sara mai vua na tamata."
bible,genesis,bible|genesis|002|023,genesis,2,23,en,fj,en->fj,"and adam said, this is now bone of my bones, and flesh of my flesh: she shall be called woman, because she was taken out of man.","sa tukuna sara o atama: ""oqo na sui mai na suiqu, na lewe mai na lewequ, sa na yalewa o koya, baleta ni a wasei mai vua na tagane. """
bible,genesis,bible|genesis|002|024,genesis,2,24,en,fj,en->fj,"therefore shall a man leave his father and his mother, and shall cleave unto his wife: and they shall be one flesh.","oqo, na vuna, ena biuta kina na tamana kei na tinana na tagane ka sema vei yalewa (watina), me rau sa yago vata."
bible,genesis,bible|genesis|002|025,genesis,2,25,en,fj,en->fj,"and they were both naked, the man and his wife, and were not ashamed.","e rau sa luvawale ruarua tu na tagane kei na watina, e rau sa sega ni madua kina."
bible,genesis,bible|genesis|003|001,genesis,3,1,en,fj,en->fj,"now the serpent was more subtil than any beast of the field which the lord god had made. and he said unto the woman, yea, hath god said, ye shall not eat of every tree of the garden?","na gata sa dauveivakaisini sara, mai vei ira kecega na manumanu ni vanua sa bulia na kalou o jiova. na gata sa tukuna vua na yalewa ka vaka: ""sa tukuna dina na kalou, 'mo drau kua ni kana mai na vunikau kecega sa tu ena i teitei'? """
bible,genesis,bible|genesis|003|002,genesis,3,2,en,fj,en->fj,"and the woman said unto the serpent, we may eat of the fruit of the trees of the garden:","sa tukuna mai na yalewa vua na gata, ""keirau na kana mai na kau kecega sa tu ena i teitei;"
bible,genesis,bible|genesis|003|003,genesis,3,3,en,fj,en->fj,"but of the fruit of the tree which is in the midst of the garden, god hath said, ye shall not eat of it, neither shall ye touch it, lest ye die.","""ia, na vuanikau mai na vunikau ga sa tiko e na loma donu ni teitei, sa tukuna na kalou, 'mo drau kakua ni kania, se mo drau tara, de drau mate. '"""
bible,genesis,bible|genesis|003|004,genesis,3,4,en,fj,en->fj,"and the serpent said unto the woman, ye shall not surely die:","sa tukuna mai na gata vua na yalewa, ""drau na sega dina ni mate."
bible,genesis,bible|genesis|003|005,genesis,3,5,en,fj,en->fj,"for god doth know that in the day ye eat thereof, then your eyes shall be opened, and ye shall be as gods, knowing good and evil.","""ni sa kila na kalou, mai na siga drau na kania kina, ena rai na matamudrau, drau na vakatalega na kalou ena nomudrau kila na veika vinaka kei na veika ca. """
bible,genesis,bible|genesis|003|006,genesis,3,6,en,fj,en->fj,"and when the woman saw that the tree was good for food, and that it was pleasant to the eyes, and a tree to be desired to make one wise, she took of the fruit thereof, and did eat, and gave also unto her husband with her; and he did eat.","na yalewa, ni sa raica na vunikau, ni sa vinaka me kakana, ka sa vinaka talega ki na mata, sa domona talega na vunikau me vuku kina, sa tauca sara na vuana ka kania. sa solia talega vei watina e rau sa tiko vata, sa kana talega o tagane."
bible,genesis,bible|genesis|003|007,genesis,3,7,en,fj,en->fj,"and the eyes of them both were opened, and they knew that they were naked; and they sewed fig leaves together, and made themselves aprons.","sa qai rai na matadrau, ka rau sa kila ni rau sa luvawale ruarua. e rau sa cula vata na drau ni lolo me nodrau i sulu."
bible,genesis,bible|genesis|003|008,genesis,3,8,en,fj,en->fj,and they heard the voice of the lord god walking in the garden in the cool of the day: and adam and his wife hid themselves from the presence of the lord god amongst the trees of the garden.,"e rau sa qai rogoca na rorogo ni nona veilakoyaki voli na kalou o jiova ena loma ni teitei ena batabata vinaka ni siga, ka rau sa vunitaki rau mai na mata ni kalou o jiova ena veivunikau ni teitei."
bible,genesis,bible|genesis|003|009,genesis,3,9,en,fj,en->fj,"and the lord god called unto adam, and said unto him, where art thou?","sa kaci yani na kalou o jiova vei atama ka vaka: ""o sa tiko e vei? """
bible,genesis,bible|genesis|003|010,genesis,3,10,en,fj,en->fj,"and he said, i heard thy voice in the garden, and i was afraid, because i was naked; and i hid myself.","sa sauma mai o atama ka vaka: ""au sa rogoca na domomuni e nai teitei, ka au sa rere vakalevu baleta ni'u sa luvawale tu, au sa qai vuni. """
bible,genesis,bible|genesis|003|011,genesis,3,11,en,fj,en->fj,"and he said, who told thee that thou wast naked? hast thou eaten of the tree, whereof i commanded thee that thou shouldest not eat?","na kalou o jiova sa taro tale mai, ""o cei e tukuna ni o sa luvawale tu? o sa kana beka mai na vunikau, au a vakarota vei iko mo kua ni kana mai kina? """
bible,genesis,bible|genesis|003|012,genesis,3,12,en,fj,en->fj,"and the man said, the woman whom thou gavest to be with me, she gave me of the tree, and i did eat.","sa sauma mai na tamata, ""na yalewa ga o ni a solia mai vei au me keirau tiko vata, o koya ga sa solia mai vei au na vua ni vunikau oqo, au sa kania sara. """
bible,genesis,bible|genesis|003|013,genesis,3,13,en,fj,en->fj,"and the lord god said unto the woman, what is this that thou hast done? and the woman said, the serpent beguiled me, and i did eat.","na kalou o jiova sa tukuna vua na yalewa, ""na cava sara mada oqo, o sa cakava? "" sa sauma na yalewa ka vaka: ""sa vakaisini au na gata, ka, au sa kana sara. """
bible,genesis,bible|genesis|003|014,genesis,3,14,en,fj,en->fj,"and the lord god said unto the serpent, because thou hast done this, thou art cursed above all cattle, and above every beast of the field; upon thy belly shalt thou go, and dust shalt thou eat all the days of thy life:","na kalou o jiova sa tukuna vua na gata: ""baleta na veika o sa cakava oqo, o sa rukaki vakalevu cake kina mai vei ira na manumanu ni vanua; o na lako voli e ketemu, o na kania na kuvu ni qele ena veisiga kece o sa bula kina."
bible,genesis,bible|genesis|003|015,genesis,3,15,en,fj,en->fj,"and i will put enmity between thee and the woman, and between thy seed and her seed; it shall bruise thy head, and thou shalt bruise his heel.","au na vaka veimecakitaki iko kei na yalewa, o ira na nomu kawa kei na nona kawa; o koya ena vakamavoataka na ulumu, ka o na vakamavoataka na bukubuku ni yavana. """
bible,genesis,bible|genesis|003|016,genesis,3,16,en,fj,en->fj,"unto the woman he said, i will greatly multiply thy sorrow and thy conception; in sorrow thou shalt bring forth children; and thy desire shall be to thy husband, and he shall rule over thee.","na kalou o jiova sa tukuna talega vua na yalewa; ""au na vakalevutaka vei iko na rarawa ena gauna ni nomu kunekune; ena mosi levu, o na vakasucuma mai kina na gone; na nomu gagadre sa na tiko ga vua na watimu, ka ena vakatulewa tiko ga vei iko o koya. """
bible,genesis,bible|genesis|003|017,genesis,3,17,en,fj,en->fj,"and unto adam he said, because thou hast hearkened unto the voice of thy wife, and hast eaten of the tree, of which i commanded thee, saying, thou shalt not eat of it: cursed is the ground for thy sake; in sorrow shalt thou eat of it all the days of thy life;","na kalou o jiova sa tukuna vakaoqo vei atama, ""baleta ni o sa vakarorogo ki na domo i watimu, ka o sa kana mai na vunikau au a vakarota vei iko ka vaka, 'mo kua ni kana mai kina': ""sa rukaki na qele ena vukumu; o na buno ka oca ni o sa kana mai kina, ena veisiga kece ni nomu bula."
bible,genesis,bible|genesis|003|018,genesis,3,18,en,fj,en->fj,thorns also and thistles shall it bring forth to thee; and thou shalt eat the herb of the field;,"na co kei na kau vakavotona sa na basika mai ena vukumu, o na kania na botebotekoro era na tubu mai."
