domain,subdomain,source_id,book,chapter,verse,source_lang,target_lang,direction,source_text,target_text
bible,genesis,bible|genesis|037|020,genesis,37,20,en,fj,en->fj,"come now therefore, and let us slay him, and cast him into some pit, and we will say, some evil beast hath devoured him: and we shall see what will become of his dreams.","""mai, me da sa na vakamatei koya ka viritaki koya ki na dua na qara, me noda i ulubale, 'me dua na manumanu kila sa vakamatei koya, ' eda na qai raica se sa vakacava na nona tadra! """
bible,genesis,bible|genesis|037|021,genesis,37,21,en,fj,en->fj,"and reuben heard it, and he delivered him out of their hands; and said, let us not kill him.","ia, ni sa rogoca o rupeni, sa vakabulai koya mai na ligadra ka tukuna, ""me da kua ni vakamatei koya. """
bible,genesis,bible|genesis|037|022,genesis,37,22,en,fj,en->fj,"and reuben said unto them, shed no blood, but cast him into this pit that is in the wilderness, and lay no hand upon him; that he might rid him out of their hands, to deliver him to his father again.","sa tukuna vei ira o rupeni, ""me kua ni vakadavei na dra, me viritaki ga ki na qara sa tiko mai na vanua liwa, me kua ga ni da tarai koya ena ligada"" â€œni sa nakita me vakabulai joseva mai vei ira na tacina ka kauti koya lesu vei tamadra."
bible,genesis,bible|genesis|037|023,genesis,37,23,en,fj,en->fj,"and it came to pass, when joseph was come unto his brethren, that they stript joseph out of his coat, his coat of many colours that was on him;","ni sa qai yaco mai vei ira o joseva, era sa basuraka na nona kote, na kote dui rokaroka sa dara tiko."
bible,genesis,bible|genesis|037|024,genesis,37,24,en,fj,en->fj,"and they took him, and cast him into a pit: and the pit was empty, there was no water in it.","era sa tauri koya ka viritaki koya ki na qara. sa lala tu na qara, ni sa maca tu na kena wai."
bible,genesis,bible|genesis|037|025,genesis,37,25,en,fj,en->fj,"and they sat down to eat bread: and they lifted up their eyes and looked, and, behold, a company of ishmeelites came from gilead with their camels bearing spicery and balm and myrrh, going to carry it down to egypt.","era sa dabe sobu ka kana. ni ra sa rai yani, era sa lako tiko mai e dua nai lawalawa era luvei isimeli, era lako tiko mai kiliati kei na nodra kameli, kei na nodra i usausa ni voliciri ena nodra lako sobu tiko ki ijipita."
bible,genesis,bible|genesis|037|026,genesis,37,26,en,fj,en->fj,"and judah said unto his brethren, what profit is it if we slay our brother, and conceal his blood?","sa tukuna o juta vei ira na tacina, ""na cava na kena yaga, kevaka e da na vakamatei koya ka vunitaka na nona dra?"
bible,genesis,bible|genesis|037|027,genesis,37,27,en,fj,en->fj,"come, and let us sell him to the ishmeelites, and let not our hand be upon him; for he is our brother and our flesh. and his brethren were content.","""me da volitaki koya vei ira na isimeli, me kua ni tarai koya kina na ligada, ni o koya e tacida ka eda lewe vata. "" era sa rogoca na tacina na veika oqo."
bible,genesis,bible|genesis|037|028,genesis,37,28,en,fj,en->fj,"then there passed by midianites merchantmen; and they drew and lifted up joseph out of the pit, and sold joseph to the ishmeelites for twenty pieces of silver: and they brought joseph into egypt.","era sa lako tale mai na kai mitiani dauveivoli, era sa tauri joseva mai ka volitaki koya yani vei ira na isimeli me ruasagavulu na sikele siliva. era sa kauti joseva ki ijipita."
bible,genesis,bible|genesis|037|029,genesis,37,29,en,fj,en->fj,"and reuben returned unto the pit; and, behold, joseph was not in the pit; and he rent his clothes.","sa lesu yani o rupeni ki na qara, ka sa yali kina o joseva, sa basuraka na nona i sulu."
bible,genesis,bible|genesis|037|030,genesis,37,30,en,fj,en->fj,"and he returned unto his brethren, and said, the child is not; and i, whither shall i go?","sa lesu yani vei iratou na tacina ka tukuna, ""sa yali na gone, me'u lako beka i vei? """
bible,genesis,bible|genesis|037|031,genesis,37,31,en,fj,en->fj,"and they took joseph's coat, and killed a kid of the goats, and dipped the coat in the blood;","era sa taura na kote i joseva, ka vakamatea e dua na me, sa qai toni na kote ena kena dra."
bible,genesis,bible|genesis|037|032,genesis,37,32,en,fj,en->fj,"and they sent the coat of many colours, and they brought it to their father; and said, this have we found: know now whether it be thy son's coat or no.","era sa vakauta mai na kote vei tamadra ka tukuna, ""keimami sa kunea oqo, mo raica oqo, e nei luvemu se sega? """
bible,genesis,bible|genesis|037|033,genesis,37,33,en,fj,en->fj,"and he knew it, and said, it is my son's coat; an evil beast hath devoured him; joseph is without doubt rent in pieces.","sa kila o jekope ka tukuna, ""oqo na kote nei luvequ, e dua na manumanu kila sa kani koya, sa sega ni cala, o joseva sa basuki vakalalai. """
bible,genesis,bible|genesis|037|034,genesis,37,34,en,fj,en->fj,"and jacob rent his clothes, and put sackcloth upon his loins, and mourned for his son many days.",sa basuraka na nona i sulu o jekope ka vakaisulu taga na tolona ka lolokutaki joseva me vica vata na siga.
bible,genesis,bible|genesis|037|035,genesis,37,35,en,fj,en->fj,"and all his sons and all his daughters rose up to comfort him; but he refused to be comforted; and he said, for i will go down into the grave unto my son mourning. thus his father wept for him.","o ira kece na luvena era sa mai vakacegui koya, sa tukuna o jekope, ""au na lako sobu ki nai bulubulu vei luvequ ena vakaloloku. "" sa tagi o jekope ena vukuna."
bible,genesis,bible|genesis|037|036,genesis,37,36,en,fj,en->fj,"and the midianites sold him into egypt unto potiphar, an officer of pharaoh's, and captain of the guard.",o ira na mitiani era sa volitaki joseva sara ki ijipita vei potifa na vakai lesilesi i fero ka sa nodra i liuliu na mata yadra.
bible,genesis,bible|genesis|038|001,genesis,38,1,en,fj,en->fj,"and it came to pass at that time, that judah went down from his brethren, and turned in to a certain adullamite, whose name was hirah.","sa yaco ena dua na gauna sa lako tani mai kina o juta mai vei ira na tacina, sa sikova yani e dua mai etulama na yacana o ira."
bible,genesis,bible|genesis|038|002,genesis,38,2,en,fj,en->fj,"and judah saw there a daughter of a certain canaanite, whose name was shuah; and he took her, and went in unto her.","sa raica talega mai kea e dua na goneyalewa ni kenani, na luvei sua, sa vakawatitaki koya ka curumi koya sara."
bible,genesis,bible|genesis|038|003,genesis,38,3,en,fj,en->fj,"and she conceived, and bare a son; and he called his name er.",sa kunekune ka vakasucuma vua e dua na luvena talega sa yacana o eri.
bible,genesis,bible|genesis|038|004,genesis,38,4,en,fj,en->fj,"and she conceived again, and bare a son; and she called his name onan.","sa kunekune tale, ka vakasucuma e dua na tagane, sa vakayacani koya o tinana me o onani."
bible,genesis,bible|genesis|038|005,genesis,38,5,en,fj,en->fj,"and she yet again conceived, and bare a son; and called his name shelah: and he was at chezib, when she bare him.","sa dua tale na luvena tagane, sa yacana o sela. sa tiko mai jesiba ena gauna sa sucu kina o sela."
bible,genesis,bible|genesis|038|006,genesis,38,6,en,fj,en->fj,"and judah took a wife for er his firstborn, whose name was tamar.","o juta sa kauta mai e dua na wati eri, na nona ulumatua, na yacana o tamare."
bible,genesis,bible|genesis|038|007,genesis,38,7,en,fj,en->fj,"and er, judah's firstborn, was wicked in the sight of the lord; and the lord slew him.","ia, o eri na ulumatua i juta, sa caka ca ena mata i jiova, o jiova ga sa vakamatei koya."
bible,genesis,bible|genesis|038|008,genesis,38,8,en,fj,en->fj,"and judah said unto onan, go in unto thy brother's wife, and marry her, and raise up seed to thy brother.","o juta sa tukuna vei onani, ""lako vei wati tacimu, mo drau veiwatini, ka vakatubura e dua na kawa vei tacimu. """
bible,genesis,bible|genesis|038|009,genesis,38,9,en,fj,en->fj,"and onan knew that the seed should not be his; and it came to pass, when he went in unto his brother's wife, that he spilled it on the ground, lest that he should give seed to his brother.","sa kila o onami ni o na luvena ena sega ni nona, sa vakadrodroya kina qele, ena gauna sa curumi wati tacina tiko kina â€œde qai solia na kawa vei tacina."
bible,genesis,bible|genesis|038|010,genesis,38,10,en,fj,en->fj,and the thing which he did displeased the lord: wherefore he slew him also.,"na veika oqo sa sega ni marautaka o jiova, oqo, sa vakamatei onani talega kina."
bible,genesis,bible|genesis|038|011,genesis,38,11,en,fj,en->fj,"then said judah to tamar his daughter in law, remain a widow at thy father's house, till shelah my son be grown: for he said, lest peradventure he die also, as his brethren did. and tamar went and dwelt in her father's house.","sa tukuna o juta vei vugona o tamare, ""mo tiko yada mada ena vale i tamamu, "" me yacova ni sa cauravou mai o sela. "" de qai mate tale me vakataki tacina. "" sa lako o tamare ka tiko wawa ena vale nei tamana."
bible,genesis,bible|genesis|038|012,genesis,38,12,en,fj,en->fj,"and in process of time the daughter of shuah judah's wife died; and judah was comforted, and went up unto his sheepshearers to timnath, he and his friend hirah the adullamite.","sa yaco na gauna sa mate kina na wati juta, sa vakacegui ka lako cake vei ira na nona dauvakatawa sipi e timana, o koya kei na nona i tokani o ira na kai etulama."
bible,genesis,bible|genesis|038|013,genesis,38,13,en,fj,en->fj,"and it was told tamar, saying, behold thy father in law goeth up to timnath to shear his sheep.","sa tukuni vei tamare, ""raica o nomu momo sa lako cake i timana me raica na nona sipi. """
bible,genesis,bible|genesis|038|014,genesis,38,14,en,fj,en->fj,"and she put her widow's garments off from her, and covered her with a vail, and wrapped herself, and sat in an open place, which is by the way to timnath; for she saw that shelah was grown, and she was not given unto him to wife.","sa luvata tani na nona i sulu vaka yada, sa ubi koya ka la'ki dabe tiko ena tikina lala ena sala vaka ki timana; ni sa raici sela sa cauravou levu mai â€œia sa sega ga ni lako yani me rau veiwatini."
bible,genesis,bible|genesis|038|015,genesis,38,15,en,fj,en->fj,"when judah saw her, he thought her to be an harlot; because she had covered her face.","ni sa raici koya o juta, sa nanuma ni oqo e dua e volitaki koya tiko, baleta ni ubia tiko na matana taucoko."
bible,genesis,bible|genesis|038|016,genesis,38,16,en,fj,en->fj,"and he turned unto her by the way, and said, go to, i pray thee, let me come in unto thee; (for he knew not that she was his daughter in law. ) and she said, what wilt thou give me, that thou mayest come in unto me?","sa vuki yani vua ena sala ka tukuna, ""au kerea me'u curumi iko mada, "" sa sega ni kila, o ya o na vugona. sa taroga o vugona, ""na cava o na solia vei au, me rawa ni o curumi au kina? """
bible,genesis,bible|genesis|038|017,genesis,38,17,en,fj,en->fj,"and he said, i will send thee a kid from the flock. and she said, wilt thou give me a pledge, till thou send it?","sa sauma mai, ""au na solia mai e dua na me gone. "" sa tukuna tale yani, ""mo solia mai e dua na kena i vakadinadina? """
bible,genesis,bible|genesis|038|018,genesis,38,18,en,fj,en->fj,"and he said, what pledge shall i give thee? and she said, thy signet, and thy bracelets, and thy staff that is in thine hand. and he gave it her, and came in unto her, and she conceived by him.","""na cava me'u solia vei iko? "" sa sauma mai na nomu i taube/mama kei na nomu i titoko. "" sa mani solia yani vua, ka curumi koya sara ka sa kunekune talega mai vua."
bible,genesis,bible|genesis|038|019,genesis,38,19,en,fj,en->fj,"and she arose, and went away, and laid by her vail from her, and put on the garments of her widowhood.","sa tucake ka lako yani, sa veisautaka na nona i sulu ka dara tale na nona i sulu vakayada."
bible,genesis,bible|genesis|038|020,genesis,38,20,en,fj,en->fj,"and judah sent the kid by the hand of his friend the adullamite, to receive his pledge from the woman's hand: but he found her not.","sa vakauta yani o juta na me gone, mai na ligana na nona i tokani na kai etulama vua na yalewa. ia, sa sega ga ni kune."
bible,genesis,bible|genesis|038|021,genesis,38,21,en,fj,en->fj,"then he asked the men of that place, saying, where is the harlot, that was openly by the way side? and they said, there was no harlot in this place.","sa tarogi ira na tagane ena vanua o ya, ""e vei o koya na dau volivolitaki sa tu ena sala? "" era sa sauma, ""sa sega eke na dauvolivolitaki sa tu ena sala. """
bible,genesis,bible|genesis|038|022,genesis,38,22,en,fj,en->fj,"and he returned to judah, and said, i cannot find her; and also the men of the place said, that there was no harlot in this place.","sa lesu tale yani vei juta ka tukuna, ""au sa sega ni raici koya, o ira talega na tagane mai keau era sa tukuna ni sa sega na dauvolivolitaki vakaoqo ena vanua. """
bible,genesis,bible|genesis|038|023,genesis,38,23,en,fj,en->fj,"and judah said, let her take it to her, lest we be shamed: behold, i sent this kid, and thou hast not found her.","sa tukuna o juta, ""me sa taura ga yani o koya de daru na qai madua â€œni'u sa solia yani na me, ia sa yali o koya. """
bible,genesis,bible|genesis|038|024,genesis,38,24,en,fj,en->fj,"and it came to pass about three months after, that it was told judah, saying, tamar thy daughter in law hath played the harlot; and also, behold, she is with child by whoredom. and judah said, bring her forth, and let her be burnt.","ni sa oti tale e tolu na vula, sa tukuni sara vei juta ka vaka: ""o tamare na vugomu ea volitaki koya ena sala ka sa bukete tiko. "" sa tukuna yani o juta, ""kauti koya mai me mai vakamai! """
bible,genesis,bible|genesis|038|025,genesis,38,25,en,fj,en->fj,"when she was brought forth, she sent to her father in law, saying, by the man, whose these are, am i with child: and she said, discern, i pray thee, whose are these, the signet, and bracelets, and staff.","ni sa kau mai, sa tukuna vei nona momo, ""o koya na tagane sa nona oqo, sa vakabuketetaki au, "" mo raica mada se nei cei oqo, nai taube, mama kei na i titoko. """
bible,genesis,bible|genesis|038|026,genesis,38,26,en,fj,en->fj,"and judah acknowledged them, and said, she hath been more righteous than i; because that i gave her not to shelah my son. and he knew her again no more.","sa tukuna o juta, ni sa kila ka sa tukuna, ""sa yalododonu cake o koya mai vei au, ni'u sa sega ni soli koya vei sela baleta ni sa tamata levu mai. "" sa sega ni curumi koya tale."
bible,genesis,bible|genesis|038|027,genesis,38,27,en,fj,en->fj,"and it came to pass in the time of her travail, that, behold, twins were in her womb.","ena gauna me sa vakasucu kina, sa tiko e ketena e rua na gone."
bible,genesis,bible|genesis|038|028,genesis,38,28,en,fj,en->fj,"and it came to pass, when she travailed, that the one put out his hand: and the midwife took and bound upon his hand a scarlet thread, saying, this came out first.","ni sa vakasucu tiko, sa basika mai e dua na liga, o koya na dau ni veivakasucumi sa vesuka sara e dua na wa lokaloka e ligana ka tukuna, ""oqo e liu mai. """
bible,genesis,bible|genesis|038|029,genesis,38,29,en,fj,en->fj,"and it came to pass, as he drew back his hand, that, behold, his brother came out: and she said, how hast thou broken forth? this breach be upon thee: therefore his name was called pharez.","na ka e yaco ni sa vakasuka lesu tale na ligana, sa basika mai o tacina vakasauri ni sega ni namaki, ka tukuna sara, ""o lako mai vakacava? o takoso mai. "" sa yacana kina me o veresi."
bible,genesis,bible|genesis|038|030,genesis,38,30,en,fj,en->fj,"and afterward came out his brother, that had the scarlet thread upon his hand: and his name was called zarah.",ni oti oqo sa qai basika mai o tacina ni sa tiko e ligana na wa lokaloka. sa yacana o sira.
bible,genesis,bible|genesis|039|001,genesis,39,1,en,fj,en->fj,"and joseph was brought down to egypt; and potiphar, an officer of pharaoh, captain of the guard, an egyptian, bought him of the hands of the ishmeelites, which had brought him down thither.","sa kau sobu o joseva ki ijipita. o potifa nai vakalesilesi nei fero ka nodra i liuliu na mata yadra, sa voli koya mai vei ira na isimeli."
bible,genesis,bible|genesis|039|002,genesis,39,2,en,fj,en->fj,"and the lord was with joseph, and he was a prosperous man; and he was in the house of his master the egyptian.",sa tiko vata kei joseva o jiova. sa tamata yaco o koya; ka sa tiko ena vale ni nona turaga na kai ijipita.
bible,genesis,bible|genesis|039|003,genesis,39,3,en,fj,en->fj,"and his master saw that the lord was with him, and that the lord made all that he did to prosper in his hand.",sa raica tiko na nona turaga ni sa tiko vata kei koya o jiova. o jiova sa vakavuna na vuavuai vinaka na veika sa tara tiko na ligana.
bible,genesis,bible|genesis|039|004,genesis,39,4,en,fj,en->fj,"and joseph found grace in his sight, and he served him: and he made him overseer over his house, and all that he had he put into his hand.",sa taleitaki tiko vakalevu o joseva mai vua na nona turaga. sa yaco me lewa taucoko na vale ni nona turaga.
bible,genesis,bible|genesis|039|005,genesis,39,5,en,fj,en->fj,"and it came to pass from the time that he had made him overseer in his house, and over all that he had, that the lord blessed the egyptian's house for joseph's sake; and the blessing of the lord was upon all that he had in the house, and in the field.","sa yaco talega me vakalouvinakataka o jiova na nona vale na kai ijipita oqo, ena vuku i joseva, na kalouvinaka oqo sa tara yani na loma ni vale kei na vei ka e tuba."
bible,genesis,bible|genesis|039|006,genesis,39,6,en,fj,en->fj,"and he left all that he had in joseph's hand; and he knew not ought he had, save the bread which he did eat. and joseph was a goodly person, and well favoured.","sa soli na veika kecega ki na ligai joseva, sa sega ni via kila tale e dua na ka, vakavo ga na madrai ni sa taura e ligana me kana. sa tamata rairai vinaka talega o joseva."
bible,genesis,bible|genesis|039|007,genesis,39,7,en,fj,en->fj,"and it came to pass after these things, that his master's wife cast her eyes upon joseph; and she said, lie with me.","ni sa yaco tiko na veika oqo, na wati potifa sa domoni joseva vakalevu, sa mani tukuna kina vei joseva, ""daru veidomoni mada. """
bible,genesis,bible|genesis|039|008,genesis,39,8,en,fj,en->fj,"but he refused, and said unto his master's wife, behold, my master wotteth not what is with me in the house, and he hath committed all that he hath to my hand;","sa bese o joseva ka tukuna, ""raica na noqu turaga sa sega ni kila na ka kece sa tu oqo e vale, baleta ni sa solia kece tu oqo ki na ligaqu."
bible,genesis,bible|genesis|039|009,genesis,39,9,en,fj,en->fj,"there is none greater in this house than i; neither hath he kept back any thing from me but thee, because thou art his wife: how then can i do this great wickedness, and sin against god?","""sa sega ni dua e uasivi vei au ena vale oqo, sa sega talega ni vakavoca vei au e dua na ka me'u lewa, au sa lewa kecega, vakavo duadua o iko, ni o sa watina. me'u cakava vakacava nai valavala ca levu oqo, nai valavala ca vua na kalou? """
bible,genesis,bible|genesis|039|010,genesis,39,10,en,fj,en->fj,"and it came to pass, as she spake to joseph day by day, that he hearkened not unto her, to lie by her, or to be with her.",sa sagai joseva tikoga ena veisiga â€œsa sega ga ni via rogoci koya o joseva.
bible,genesis,bible|genesis|039|011,genesis,39,11,en,fj,en->fj,"and it came to pass about this time, that joseph went into the house to do his business; and there was none of the men of the house there within.","sa qai yaco ni sa lako tale yani o joseva me cakava na nona cakacaka e vale â€œsa sega na tagane me kune e vale,"
bible,genesis,bible|genesis|039|012,genesis,39,12,en,fj,en->fj,"and she caught him by his garment, saying, lie with me: and he left his garment in her hand, and fled, and got him out.","sa vesuki joseva vata kei na nona i oro bale ka tukuna, ""daru mai veicurumi mada. "" sa biuta tu na nona i oro bale e ligana ka dro yani ki tuba."
bible,genesis,bible|genesis|039|013,genesis,39,13,en,fj,en->fj,"and it came to pass, when she saw that he had left his garment in her hand, and was fled forth,","sa qai yaco, ni sa raica ni sa biuta tu mai o joseva na nona i oro ena ligana ka dro yani ki tuba,"
bible,genesis,bible|genesis|039|014,genesis,39,14,en,fj,en->fj,"that she called unto the men of her house, and spake unto them, saying, see, he hath brought in an hebrew unto us to mock us; he came in unto me to lie with me, and i cried with a loud voice:","sa kacivi ira mai na turaga ena vale ka tukuna vei ira, ""raica sa kau mai vei keda e dua na iperiu oqo me vakalialiai keda. sa lako mai ka vakasagai au, ka vinakata me moceri au, au sa qai kaila vakadomoi levu."
bible,genesis,bible|genesis|039|015,genesis,39,15,en,fj,en->fj,"and it came to pass, when he heard that i lifted up my voice and cried, that he left his garment with me, and fled, and got him out.","""ni sa rogoca o koya ni'u sa qoqolou, sa qai biuta tu mai na nona i oro ka dro yani ki tuba. """
bible,genesis,bible|genesis|039|016,genesis,39,16,en,fj,en->fj,"and she laid up his garment by her, until his lord came home.",sa taura tiko ga na nona i oro me yacova ni sa lako mai na nona turaga ki vale.
bible,genesis,bible|genesis|039|017,genesis,39,17,en,fj,en->fj,"and she spake unto him according to these words, saying, the hebrew servant, which thou hast brought unto us, came in unto me to mock me:","sa qai vosa vua me vaka oqo: ""na iperiu dauveiqaravi o a kauta mai vei keda, sa lako mai vei au me vakalialiai au;"
bible,genesis,bible|genesis|039|018,genesis,39,18,en,fj,en->fj,"and it came to pass, as i lifted up my voice and cried, that he left his garment with me, and fled out.","""ena gauna au sa kaikaila kina, sa biuta tu mai na nona i oro ka dro yani ki tuba. """
bible,genesis,bible|genesis|039|019,genesis,39,19,en,fj,en->fj,"and it came to pass, when his master heard the words of his wife, which she spake unto him, saying, after this manner did thy servant to me; that his wrath was kindled.","ni sa rogoca o nona turaga na veika sa tukuna vua o watina ni sa tukuna, ""na nomu tamata sa cakava vaka oqo vei au, "" sa tubu sara na nona cudru."
bible,genesis,bible|genesis|039|020,genesis,39,20,en,fj,en->fj,"and joseph's master took him, and put him into the prison, a place where the king's prisoners were bound: and he was there in the prison.",na turaga i joseva sa tauri koya ka biuta ki vale ni veivesu. na vanua era sa tiko kina na kaivesu ni tui. sa tiko talega kina o joseva.
bible,genesis,bible|genesis|039|021,genesis,39,21,en,fj,en->fj,"but the lord was with joseph, and shewed him mercy, and gave him favour in the sight of the keeper of the prison.","ia, o jiova sa tiko vata ga kei joseva, ka sa vakaraitaka tiko vua na nona loloma. sa solia tiko ga vei joseva na nona vinaka ena mata i koya na i vakatawa ni vale ni veivesu."
bible,genesis,bible|genesis|039|022,genesis,39,22,en,fj,en->fj,"and the keeper of the prison committed to joseph's hand all the prisoners that were in the prison; and whatsoever they did there, he was the doer of it.",nai vakatawa ni valeniveivesu sa solia kece ki na ligai joseva na lewa ni nodra bula kece na kaivesu; na ka kece era cakava sa nona lewa ga.
bible,genesis,bible|genesis|039|023,genesis,39,23,en,fj,en->fj,"the keeper of the prison looked not to any thing that was under his hand; because the lord was with him, and that which he did, the lord made it to prosper.","sa sega tale ni via kila mai nai vakatawa ni valeniveivesu e dua na ka, baleta ni sa tiko vata kei koya o jiova. na veika kece e caka, sa vakagugumatuataka o jiova."
bible,genesis,bible|genesis|040|001,genesis,40,1,en,fj,en->fj,"and it came to pass after these things, that the butler of the king of egypt and his baker had offended their lord the king of egypt.","sa qai yaco ena dua na gauna, o koya na dauvakarau mena waini kei koya na dau vavi kakana nei fero, e rau sa caka cala vua na nodrau turaga na tui ijipita."
bible,genesis,bible|genesis|040|002,genesis,40,2,en,fj,en->fj,"and pharaoh was wroth against two of his officers, against the chief of the butlers, and against the chief of the bakers.","o fero sa cudruvi rau vakalevu na nona dauveiqaravi oqo, na i liuliu ni caka waini kei nai liuliu ni dauvavavi."
bible,genesis,bible|genesis|040|003,genesis,40,3,en,fj,en->fj,"and he put them in ward in the house of the captain of the guard, into the prison, the place where joseph was bound.",sa biuti rau ena ligai koya nai liuliu ni mata yadra ni valeniveivesu. ena vanua sa vesu tiko kina o joseva.
bible,genesis,bible|genesis|040|004,genesis,40,4,en,fj,en->fj,"and the captain of the guard charged joseph with them, and he served them: and they continued a season in ward.","nai liuliu ni mata yadra sa beitaki joseva vata kei rau, ka sa qaravi rau. e ratou s vesu tiko vakawawa."
bible,genesis,bible|genesis|040|005,genesis,40,5,en,fj,en->fj,"and they dreamed a dream both of them, each man his dream in one night, each man according to the interpretation of his dream, the butler and the baker of the king of egypt, which were bound in the prison.","o koya na dauvakarau waini kei koya na dauvavavi nei fero, e rau sa tadra ruarua, na nodrau tadra yadudua ena dua ga na bogi, ka duidui na kena i balebale."
bible,genesis,bible|genesis|040|006,genesis,40,6,en,fj,en->fj,"and joseph came in unto them in the morning, and looked upon them, and, behold, they were sad.","sa lako mai vei rau o joseva ena mataka, ka raici rau, sa raica ni rau sa rarawa sara vakalevu."
