domain,subdomain,source_id,book,chapter,verse,source_lang,target_lang,direction,source_text,target_text
bible,genesis,bible|genesis|017|013,genesis,17,13,en,fj,en->fj,"he that is born in thy house, and he that is bought with thy money, must needs be circumcised: and my covenant shall be in your flesh for an everlasting covenant.","""o koya sucu e vale kei ira sa voli ena i lavo me ra cilivi, na noqu veiyalayalati oqo me tiko ena yagomuni (lewemuni) me veiyalayalati e sega ni mudu."
bible,genesis,bible|genesis|017|014,genesis,17,14,en,fj,en->fj,"and the uncircumcised man child whose flesh of his foreskin is not circumcised, that soul shall be cut off from his people; he hath broken my covenant.","""na gone tagane sa sega ni cilivi, o ira sa sega ni cilivi na lewedra, o koya oqo me qai muduki tani mai vei ira na kawa, baleta ni sa voroka na noqu veiyalayalati. """
bible,genesis,bible|genesis|017|015,genesis,17,15,en,fj,en->fj,"and god said unto abraham, as for sarai thy wife, thou shalt not call her name sarai, but sarah shall her name be.","na kalou sa tukuna vei eparaama, ""vei serai na watimu, ena sega ni yacana o serai, me sa na yacana o sera."
bible,genesis,bible|genesis|017|016,genesis,17,16,en,fj,en->fj,"and i will bless her, and give thee a son also of her: yea, i will bless her, and she shall be a mother of nations; kings of people shall be of her.","""au na vakalouvinakataki koya, ka au na solia talega vei iko e dua na gone tagane mai vua, o koya ena tinadra na veimatanitu ni'u sa vakalouvinakataki koya, na nodra tui na veitamata era na basika mai vua. """
bible,genesis,bible|genesis|017|017,genesis,17,17,en,fj,en->fj,"then abraham fell upon his face, and laughed, and said in his heart, shall a child be born unto him that is an hundred years old? and shall sarah, that is ninety years old, bear?","sa cuva vakatoboicu o eparaama ka dredre ka tukuna e yalona, ""me vakasucumi beka e dua na gone vua e dua sa dua na drau na nona yabaki ni bula? kei sera, ni sa yabaki ciwasagavulu, me vakasucuma beka e dua na gone? """
bible,genesis,bible|genesis|017|018,genesis,17,18,en,fj,en->fj,"and abraham said unto god, o that ishmael might live before thee!","sa qai vosa o eparaama vua na kalou ka vaka: ""isa, me bula talega o isimeli e matamuni! """
bible,genesis,bible|genesis|017|019,genesis,17,19,en,fj,en->fj,"and god said, sarah thy wife shall bear thee a son indeed; and thou shalt call his name isaac: and i will establish my covenant with him for an everlasting covenant, and with his seed after him.","na kalou sa tukuna mai, ""e sega, o sera na watimu ena vakasucuma e dua na gone tagane, mo vakayacani koya me aisake; au na tekivuna na noqu veiyalayalati e sega ni mudu vata kei koya kei ira na nona kawa era na muri mai."
bible,genesis,bible|genesis|017|020,genesis,17,20,en,fj,en->fj,"and as for ishmael, i have heard thee: behold, i have blessed him, and will make him fruitful, and will multiply him exceedingly; twelve princes shall he beget, and i will make him a great nation.","""me baleti isimeli, au sa rogoci iko, raica au sa vakalouvinakataki koya, au na vakavuavuai vinakataki koya, ka au na vakalewe levu taki koya vakalevu sara. ena basika mai vua e tinikarua na ravouvou ka au na cakava me matanitu levu."
bible,genesis,bible|genesis|017|021,genesis,17,21,en,fj,en->fj,"but my covenant will i establish with isaac, which sarah shall bear unto thee at this set time in the next year.","""ia na noqu veiyalayalati au na tekivutaka mai vei aisake, o koya ena vakasucuma vei iko o sera ena gauna vakaoqo ni yabaki vou. """
bible,genesis,bible|genesis|017|022,genesis,17,22,en,fj,en->fj,"and he left off talking with him, and god went up from abraham.","na kalou sa vakaotia na nona veivosaki kei eparaama, ka sa lako cake na kalou mai vei eparaama."
bible,genesis,bible|genesis|017|023,genesis,17,23,en,fj,en->fj,"and abraham took ishmael his son, and all that were born in his house, and all that were bought with his money, every male among the men of abraham's house; and circumcised the flesh of their foreskin in the selfsame day, as god had said unto him.","o eparaama sa kauti isimeli na luvena, o ira kece sa sucu ena nona vale, o ira kece sa voli ena i lavo, na tagane kece ena vale nei eparaama, sa cilivi kece na lewedra, nai ubi ni yagodra vakatagane, ena siga vata ga sa vosa kina vua na kalou."
bible,genesis,bible|genesis|017|024,genesis,17,24,en,fj,en->fj,"and abraham was ninety years old and nine, when he was circumcised in the flesh of his foreskin.","sa yabaki ciwasagavulu ka ciwa o eparaama ena gauna sa cilivi kina na lewena, nai ubi ni yagona vakatagane."
bible,genesis,bible|genesis|017|025,genesis,17,25,en,fj,en->fj,"and ishmael his son was thirteen years old, when he was circumcised in the flesh of his foreskin.","o isimeli sa yabaki tinikatolu ena gauna sa cilivi kina na lewena, nai ubi ni yagona vakatagane."
bible,genesis,bible|genesis|017|026,genesis,17,26,en,fj,en->fj,"in the selfsame day was abraham circumcised, and ishmael his son.","ena siga vata ga o ya, sa cilivi kina o eparaama kei isimeli na luvena;"
bible,genesis,bible|genesis|017|027,genesis,17,27,en,fj,en->fj,"and all the men of his house, born in the house, and bought with money of the stranger, were circumcised with him.","kei ira kecega na tagane ena nona vale, o ira sa sucu e vale kei ira sa voli e nai lavo, era sa cilivi vata kei koya."
bible,genesis,bible|genesis|018|001,genesis,18,1,en,fj,en->fj,and the lord appeared unto him in the plains of mamre: and he sat in the tent door in the heat of the day;,"sa basika o jiova vei eparaama ena vunikau ni mamire, ena nona a dabe tiko ena mata ni nona vale laca, ena katakata ni siga."
bible,genesis,bible|genesis|018|002,genesis,18,2,en,fj,en->fj,"and he lift up his eyes and looked, and, lo, three men stood by him: and when he saw them, he ran to meet them from the tent door, and bowed himself toward the ground,","sa rai cake ka raica, e tolu na tamata sa tu vata kei koya; ni sa raici iratou, sa cici yani me sotavi iratou, sa cuva sobu ki na qele,"
bible,genesis,bible|genesis|018|003,genesis,18,3,en,fj,en->fj,"and said, my lord, if now i have found favour in thy sight, pass not away, i pray thee, from thy servant:","ka tukuna, ""noqu turaga kevaka au sa kune loloma e matamuni, mo ni kua ni lako sivia na nomuni tamata. """
bible,genesis,bible|genesis|018|004,genesis,18,4,en,fj,en->fj,"let a little water, i pray you, be fetched, and wash your feet, and rest yourselves under the tree:","""me kau mada mai e dua na wai me sava kina na yavamudou, ka dou vakacegu mada ena ruku ni vunikau."
bible,genesis,bible|genesis|018|005,genesis,18,5,en,fj,en->fj,"and i will fetch a morsel of bread, and comfort ye your hearts; after that ye shall pass on: for therefore are ye come to your servant. and they said, so do, as thou hast said.","""au na kauta mai eso na madrai me vakabulabulataka na yalomudou, ni oti o ya, dou na qai lako, oqo, baleta ni dou sa lako mai vua na nomudou tamata. "" e ratou sa tukuna mai, ""mo cakava me vaka o sa tukuna. """
bible,genesis,bible|genesis|018|006,genesis,18,6,en,fj,en->fj,"and abraham hastened into the tent unto sarah, and said, make ready quickly three measures of fine meal, knead it, and make cakes upon the hearth.","sa vakatotolo o eparaama ki na vale laca vei sera ka tukuna, ""mo cakava mada vakatotolo e tolu nai vakarau falawa, bulia eso na keke. """
bible,genesis,bible|genesis|018|007,genesis,18,7,en,fj,en->fj,"and abraham ran unto the herd, and fetcht a calf tender and good, and gave it unto a young man; and he hasted to dress it.",sa cici yani o eparaama ka vakarautaka e dua na luve ni bulumakau vinaka ka solia vua na nona cauravou me vakarautaka vakatotolo.
bible,genesis,bible|genesis|018|008,genesis,18,8,en,fj,en->fj,"and he took butter, and milk, and the calf which he had dressed, and set it before them; and he stood by them under the tree, and they did eat.","sa kauta mai na bata kei na sucu kei na manumanu sa vakarautaki, ka vakarautaka e matadratou; sa tu vakarau tuga o eparaama ena ruku ni vunikau ni ratou sa kana tiko."
bible,genesis,bible|genesis|018|009,genesis,18,9,en,fj,en->fj,"and they said unto him, where is sarah thy wife? and he said, behold, in the tent.","e ratou sa tukuna vei eparaama, ""e vei o sera na watimu? "" sa sauma mai, ""oqo ena vale laca. """
bible,genesis,bible|genesis|018|010,genesis,18,10,en,fj,en->fj,"and he said, i will certainly return unto thee according to the time of life; and, lo, sarah thy wife shall have a son. and sarah heard it in the tent door, which was behind him.","sa qai tukuna o koya, ""au na lesu tale mai vei iko ena gauna ni bula, ka raica, o sera na watimu ena vakasucuma e dua na gone tagane. "" (sa vakarorogo tu o sera ena mata ni katuba ena dakui koya e vosa tiko. )"
bible,genesis,bible|genesis|018|011,genesis,18,11,en,fj,en->fj,now abraham and sarah were old and well stricken in age; and it ceased to be with sarah after the manner of women.,o eparaama kei sera e rau sa qase sara ka sa levu na nodrau veiyabaki; sa sivia talega o sera na veiyabaki ni vakasucu gone.
bible,genesis,bible|genesis|018|012,genesis,18,12,en,fj,en->fj,"therefore sarah laughed within herself, saying, after i am waxed old shall i have pleasure, my lord being old also?","sa cuva ka dredre ga e lomana o sera ka tukuna, ""au sa qase mai oqo, me'u na ia tale beka na veidomoni, ni sa qase talega o noqu turaga? """
bible,genesis,bible|genesis|018|013,genesis,18,13,en,fj,en->fj,"and the lord said unto abraham, wherefore did sarah laugh, saying, shall i of a surety bear a child, which am old?","sa tukuna mai o jiova vei eparaama, ""na cava e dredre kina, o sera ka tukuna, 'au na vakasucu beka, ni'u sa qase mai? '"
bible,genesis,bible|genesis|018|014,genesis,18,14,en,fj,en->fj,"is any thing too hard for the lord? at the time appointed i will return unto thee, according to the time of life, and sarah shall have a son.","""e dua beka na ka e sa rui dredre vei jiova? ena gauna sa lokuci, au na lesu tale mai vei iko, me vaka na gauna ni bula, o sera ena vakasucuma mai e dua na gone tagane. """
bible,genesis,bible|genesis|018|015,genesis,18,15,en,fj,en->fj,"then sarah denied, saying, i laughed not; for she was afraid. and he said, nay; but thou didst laugh.","sa cakitaka o sera ka tukuna, ""au a sega ni dredre, "" baleta talega ni sa rere. sa tukuna mai o jiova, ""e sega, o iko, e a dredre dina! """
bible,genesis,bible|genesis|018|016,genesis,18,16,en,fj,en->fj,"and the men rose up from thence, and looked toward sodom: and abraham went with them to bring them on the way.","e ratou sa tucake na tamata, ka rai yani ki sotoma, sa lako talega vata kei iratou o eparaama me raica na nodratou lesu yani."
bible,genesis,bible|genesis|018|017,genesis,18,17,en,fj,en->fj,"and the lord said, shall i hide from abraham that thing which i do;","sa tukuna o jiova, ""me'u vunitaka beka vei eparaama na veika au na cakava,"
bible,genesis,bible|genesis|018|018,genesis,18,18,en,fj,en->fj,"seeing that abraham shall surely become a great and mighty nation, and all the nations of the earth shall be blessed in him?","""baleta, ni o eparaama ena yaco me matanitu levu ka qaqa, na veimatanitu taucoko e vuravura era na vakalouvinakataki mai vua?"
bible,genesis,bible|genesis|018|019,genesis,18,19,en,fj,en->fj,"for i know him, that he will command his children and his household after him, and they shall keep the way of the lord, to do justice and judgment; that the lord may bring upon abraham that which he hath spoken of him.","""ni'u sa kilai koya, me rawa kina vua me vakaroti ira na luvena kei ira na nona vuvale era muri koya, me ra muria na sala i jiova, me ra cakava na ka dodonu kei na lewa, me kauta mai kina o jiova vei eparaama na veika sa vosa oti kina vua. """
bible,genesis,bible|genesis|018|020,genesis,18,20,en,fj,en->fj,"and the lord said, because the cry of sodom and gomorrah is great, and because their sin is very grievous;","sa qai tukuna tale o jiova, ""baleta na tagi me baleti sotoma kei komora sa rui levu sara, kei nai valavala ca sa rui vakasisila dina,"
bible,genesis,bible|genesis|018|021,genesis,18,21,en,fj,en->fj,"i will go down now, and see whether they have done altogether according to the cry of it, which is come unto me; and if not, i will know.","""au na lako sobu oqo, me'u raica, se, sa dina na veika sa lako cake mai vei au; ke sega, au na kila. """
bible,genesis,bible|genesis|018|022,genesis,18,22,en,fj,en->fj,"and the men turned their faces from thence, and went toward sodom: but abraham stood yet before the lord.","e ratou sa lako tani mai kea na tamata, ka lako vaka ki sotoma, o eparaama e se tu ga ena mata i jiova."
bible,genesis,bible|genesis|018|023,genesis,18,23,en,fj,en->fj,"and abraham drew near, and said, wilt thou also destroy the righteous with the wicked?","sa lako voleka mai o eparaama ka tukuna, ""o ni na vakarusai ira vata na yalododonu kei ira nai valavala ca?"
bible,genesis,bible|genesis|018|024,genesis,18,24,en,fj,en->fj,peradventure there be fifty righteous within the city: wilt thou also destroy and not spare the place for the fifty righteous that are therein?,"""kevaka mada ga era sa tiko ena koro e limasagavulu na yalododonu â€œo ni na vakarusa vata kei ira na yalododonu oqo?"
bible,genesis,bible|genesis|018|025,genesis,18,25,en,fj,en->fj,"that be far from thee to do after this manner, to slay the righteous with the wicked: and that the righteous should be as the wicked, that be far from thee: shall not the judge of all the earth do right?","""e sega ni dodonu vei kemuni oqo, mo ni vakarusai ira vata na yalododonu kei ira na i valavala ca, me ra vaka kina nai valavala ca na yalododonu â€œme yawa sara vei kemuni oqo. me kua beka ni lewa vakadodonu na turaga ni lewa levu kei vuravura? """
bible,genesis,bible|genesis|018|026,genesis,18,26,en,fj,en->fj,"and the lord said, if i find in sodom fifty righteous within the city, then i will spare all the place for their sakes.","sa tukuna mai o jiova: ""kevaka au sa kunea e sotoma e limasagavulu na tamata yalododonu, au na sega ni vakarusa na koro ena vukudra na lewe limasagavulu na yalododonu oqo. """
bible,genesis,bible|genesis|018|027,genesis,18,27,en,fj,en->fj,"and abraham answered and said, behold now, i have taken upon me to speak unto the lord, which am but dust and ashes:","sa vosa tale yani o eparaama ka vaka, ""o au sa vaka ga na kuvu ni soso kei na dravusa, o cei o au me'u vosa vei jiova:"
bible,genesis,bible|genesis|018|028,genesis,18,28,en,fj,en->fj,"peradventure there shall lack five of the fifty righteous: wilt thou destroy all the city for lack of five? and he said, if i find there forty and five, i will not destroy it.","""kevaka mada ga me vasagavulu ka lima na tamata yalododonu, o ni na vakarusa tikoga na koro? "" sa tukuna mai o jiova, ""kevaka au sa raica kina e vasagavulu ka lima na tamata yalododonu, au na sega ni vakarusa na koro. """
bible,genesis,bible|genesis|018|029,genesis,18,29,en,fj,en->fj,"and he spake unto him yet again, and said, peradventure there shall be forty found there. and he said, i will not do it for forty's sake.","sa vosa tale vei jiova o eparaama, ""kevaka mada ga sa kune kina e vasagavulu na yalododonu? "" sa sauma mai o jiova, ""au na sega ni cakava ena vukudra na vasagavulu oqori. """
bible,genesis,bible|genesis|018|030,genesis,18,30,en,fj,en->fj,"and he said unto him, oh let not the lord be angry, and i will speak: peradventure there shall thirty be found there. and he said, i will not do it, if i find thirty there.","sa tukuna tale, ""me kua ni cudru mada o jiova, au na qai vosa: kevaka mada ga sa kune kina e tolusagavulu na yalododonu? "" sa sauma yani o jiova, ""au na sega ni cakava ena vukudra na tolusagavulu na yalododonu oqori. """
bible,genesis,bible|genesis|018|031,genesis,18,31,en,fj,en->fj,"and he said, behold now, i have taken upon me to speak unto the lord: peradventure there shall be twenty found there. and he said, i will not destroy it for twenty's sake.","sa tukuna tale, ""oqo sa na bale ga vei au, au na vosa yani oqo vei jiova: vakacava ke ruasagavulu na tamata yalododonu era kune ena koro? "" sa tukuna mai o jiova, ""au na sega ni vakarusa. """
bible,genesis,bible|genesis|018|032,genesis,18,32,en,fj,en->fj,"and he said, oh let not the lord be angry, and i will speak yet but this once: peradventure ten shall be found there. and he said, i will not destroy it for ten's sake.","sa tukuna tale, ""me kua ni cudru o jiova, me'u vosa tale vakadua ga, vakacava ke kune kina e tini na yalododonu? "" sa tukuna mai o jiova, ""au na sega ni vakarusa ena vukudra na lewe tini oqori. """
bible,genesis,bible|genesis|018|033,genesis,18,33,en,fj,en->fj,"and the lord went his way, as soon as he had left communing with abraham: and abraham returned unto his place.",sa lako sara yani o jiova ena nona sala ni sa vosa oti vei eparaama â€œka sa lesu tale o eparaama ki na nona tikina.
bible,genesis,bible|genesis|019|001,genesis,19,1,en,fj,en->fj,and there came two angels to sodom at even; and lot sat in the gate of sodom: and lot seeing them rose up to meet them; and he bowed himself with his face toward the ground;,"e rua na agilosi sa lako mai sotoma ena yakavi, o loti sa dabe tiko ena matamata mai sotoma. ni sa raici rau o loti, sa lako yani me sotavi rau, sa cuva ka vakarokoroko vei rau."
bible,genesis,bible|genesis|019|002,genesis,19,2,en,fj,en->fj,"and he said, behold now, my lords, turn in, i pray you, into your servant's house, and tarry all night, and wash your feet, and ye shall rise up early, and go on your ways. and they said, nay; but we will abide in the street all night.","sa tukuna sara, ""oqo, oi kemudrau na noqu turaga, drau lako mai ki na nona vale na nomuni tamata ka vakacegu mada kina ena bogi oqo, mo ni mai savata mada na yavamuni, ka qai yadra ena mataka caca ka gole yani. "" e rau sa tukuna, ""e sega, keirau na moce tuga ena saqata. """
bible,genesis,bible|genesis|019|003,genesis,19,3,en,fj,en->fj,"and he pressed upon them greatly; and they turned in unto him, and entered into his house; and he made them a feast, and did bake unleavened bread, and they did eat.","sa cikevi rau vakaukauwa, ka rau sa lako mai ki na nona vale. sa cakava veirau e dua nai vakayakavi, ka vavia veirau na madrai sega ni vakaleveni ka rau sa kana sara."
bible,genesis,bible|genesis|019|004,genesis,19,4,en,fj,en->fj,"but before they lay down, the men of the city, even the men of sodom, compassed the house round, both old and young, all the people from every quarter:","ni se bera ni rau davo sobu me moce, o ira na tagane ena koro, o ira na tagane e sotoma, kece, o ira na qase kei ira na gone â€œo ira kece mai na vei tikina, era sa mai vakavolivolita na vale ka tagava."
bible,genesis,bible|genesis|019|005,genesis,19,5,en,fj,en->fj,"and they called unto lot, and said unto him, where are the men which came in to thee this night? bring them out unto us, that we may know them.","era sa kaci yani vei loti ka tukuna, ""e vei oi rau na tamata e rau sa lako mai vei iko ena bogi oqo? kauti rau mai tuba me keimami mai tulevu taki rau mada. """
bible,genesis,bible|genesis|019|006,genesis,19,6,en,fj,en->fj,"and lot went out at the door unto them, and shut the door after him,",sa lako yani ki tuba o loti vei ira na tamata ka sogota na katuba mai dakuna;
bible,genesis,bible|genesis|019|007,genesis,19,7,en,fj,en->fj,"and said, i pray you, brethren, do not so wickedly.","ka tukuna, ""au kerei kemuni na taciqu, mo ni kua na cakava na ka vakasisila oqo!"
bible,genesis,bible|genesis|019|008,genesis,19,8,en,fj,en->fj,"behold now, i have two daughters which have not known man; let me, i pray you, bring them out unto you, and do ye to them as is good in your eyes: only unto these men do nothing; for therefore came they under the shadow of my roof.","""raica sa rua tiko na luvequ yalewa, era se bera ni kila na tagane, me'u kauti rau mai vei kemuni ka cakava vei rau na veika ga o ni vinakata; me kua ga vei rau na noqu vulagi oqo â€œni oqo ga na vuna e rau mai vakaruru kina ena noqu vale. """
bible,genesis,bible|genesis|019|009,genesis,19,9,en,fj,en->fj,"and they said, stand back. and they said again, this one fellow came in to sojourn, and he will needs be a judge: now will we deal worse with thee, than with them. and they pressed sore upon the man, even lot, and came near to break the door.","era sa tukuna mai, ""mo tu vakasuka, "" era sa tukuna tale, ""o koya mada ga oqo, e se qai lako vou mai, ka sa via mai turaganilewa sara, keimami na cakava vaka ca sara vei iko, mai vei rau na rua oqori. "" era sa vakaukauwataki loti, me baleti rau na nona vulagi, ka sa voleka sara na kabasu mai na katuba."
bible,genesis,bible|genesis|019|010,genesis,19,10,en,fj,en->fj,"but the men put forth their hand, and pulled lot into the house to them, and shut to the door.","oi rau na tamata (agilosi) e rau sa dodoka yani na ligadrau, ka dreti loti mai ki loma ni vale ka sogota na katuba."
bible,genesis,bible|genesis|019|011,genesis,19,11,en,fj,en->fj,"and they smote the men that were at the door of the house with blindness, both small and great: so that they wearied themselves to find the door.","e rau sa samuti ira na tamata ena mataboko, o ira kece sa tu ena mata ni katuba. o ira na lelevu kei ira na lalai, sa dredre kina me ra kila se e vei na katuba ni vale."
bible,genesis,bible|genesis|019|012,genesis,19,12,en,fj,en->fj,"and the men said unto lot, hast thou here any besides? son in law, and thy sons, and thy daughters, and whatsoever thou hast in the city, bring them out of this place:","e rau sa tukuna na tamata (agilosi) vei loti, ""sa tiko tale e dua na wekamu eke? na vugomu, se luvemu tagane se luvemu yalewa, se o cei ga sa tiko ena koro â€œme ra kautani yani!"
bible,genesis,bible|genesis|019|013,genesis,19,13,en,fj,en->fj,"for we will destroy this place, because the cry of them is waxen great before the face of the lord; and the lord hath sent us to destroy it.","""ni keirau na vakarusa na vanua oqo, baleta ni sa lako cake yani vei jiova na veika ca ni vanua oqo â€œsa talai keirau mai kina o jiova me vakarusa. """
bible,genesis,bible|genesis|019|014,genesis,19,14,en,fj,en->fj,"and lot went out, and spake unto his sons in law, which married his daughters, and said, up, get you out of this place; for the lord will destroy this city. but he seemed as one that mocked unto his sons in law.","sa lako yani o loti me vosa vei rau na vugona tagane (oi rau na watidrau na luvei loti yalewa) ""drau tucake ka dro yani â€œo jiova ena vakarusa na vanua oqo! "" vei rau na vugona â€œsa vaka ga e veiwali tiko o loti."
bible,genesis,bible|genesis|019|015,genesis,19,15,en,fj,en->fj,"and when the morning arose, then the angels hastened lot, saying, arise, take thy wife, and thy two daughters, which are here; lest thou be consumed in the iniquity of the city.","ni sa kida mai na mataka, e rau sa vakatotolo taki loti na agilosi ka tukuna, ""tucake, taura na watimu kei rau na luvemu yalewa, de dou qai kama vata ena vakarusai ni koro oqo. """
bible,genesis,bible|genesis|019|016,genesis,19,16,en,fj,en->fj,"and while he lingered, the men laid hold upon his hand, and upon the hand of his wife, and upon the hand of his two daughters; the lord being merciful unto him: and they brought him forth, and set him without the city.","ni se vakaberabera tikoga, na agilosi, sa taura na ligana, na ligai watina kei na ligadrau na luvena yalewa, ni sa rui lomani koya o jiova, e rau sa kauti koya mai ka sereki koya ena taudaku ni koro."
bible,genesis,bible|genesis|019|017,genesis,19,17,en,fj,en->fj,"and it came to pass, when they had brought them forth abroad, that he said, escape for thy life; look not behind thee, neither stay thou in all the plain; escape to the mountain, lest thou be consumed.","sa qai yaco ni ratou sa kau mai ki taudaku ni koro, sa qai tukuni vua, ""dro mo bula â€œkua ni rai tale i muri se mo vakacegu ena buca. dro ki na veiulunivanua, de o na vakarusai talega. """
bible,genesis,bible|genesis|019|018,genesis,19,18,en,fj,en->fj,"and lot said unto them, oh, not so, my lord:","sa tukuna yani o loti, ""isa noqu turaga, me kua oqori!"
bible,genesis,bible|genesis|019|019,genesis,19,19,en,fj,en->fj,"behold now, thy servant hath found grace in thy sight, and thou hast magnified thy mercy, which thou hast shewed unto me in saving my life; and i cannot escape to the mountain, lest some evil take me, and i die:","""sa kune loloma na nomuni tamata e matamuni; o ni sa vakalevutaka na nomuni loloma o ni sa vakaraitaka, ena nomuni vakabulai au; au sa sega ni rawa ni dro ki na veiulunivanua â€œde ra qai toboki au na ca ka vakamatei au."
bible,genesis,bible|genesis|019|020,genesis,19,20,en,fj,en->fj,"behold now, this city is near to flee unto, and it is a little one: oh, let me escape thither, (is it not a little one? ) and my soul shall live.","""sa voleka na koro oqo me'u dro kina, e koro lailai ga me'u dro kina, me bula kina na yaloqu. """
bible,genesis,bible|genesis|019|021,genesis,19,21,en,fj,en->fj,"and he said unto him, see, i have accepted thee concerning this thing also, that i will not overthrow this city, for the which thou hast spoken.","sa tukuna mai na agilosi vua, ""raica, au sa totaki iko ena vuku ni ka oqo. au na sega ni vakarusa na koro oqo, o sa digitaka mo dro kina."
bible,genesis,bible|genesis|019|022,genesis,19,22,en,fj,en->fj,"haste thee, escape thither; for i cannot do any thing till thou be come thither. therefore the name of the city was called zoar.","""totolo sara dro yani kina, au na sega mada ni cakava e dua na ka me yacova ni dou sa yaco kina. "" sa yaca ni koro o ya o soa."
bible,genesis,bible|genesis|019|023,genesis,19,23,en,fj,en->fj,the sun was risen upon the earth when lot entered into zoar.,sa cadra na siga e vuravura ni sa curu yani ki soa o loti.
